exchange_point_id, region, country, city, long_name, status, media_type, organization_type, establishment, url, member_list_url, looking_glass_url, participants, traffic, prefixes
1705, Asia-Pacific, Afghanistan, Kabul, National Internet Exchange of Afghanistan, Planned, Ethernet, Governmental, 20110500, http://mcit.gov.af/en/news/1290, , , 0, 0, 0
1849, Europe, Albania, Tirana, Albania IX, Active, Ethernet, Commercial, 20110000, http://www.albtelecom.al/en/dedicated-service/infrastructure/434-alb-ix, http://www.albtelecom.al/en/dedicated-service/infrastructure/434-alb-ix, , 8, 0, 0
1708, Africa, Algeria, Algiers, Algeria Internet Exchange, Planned, Ethernet, Governmental, 20130000, , , , 0, 0, 0
932, Africa, Angola, Luanda, Angola Internet Exchange, Active, Ethernet, Association, 20060317, http://www.angola-ixp.ao, http://www.angola-ixp.ao/membros.php, , 12, 600000, 0
1848, Africa, Angola, Luanda, ANGONIX, Active, Ethernet, Commercial, 20150309, http://angonix.net, http://angonix.net/customers-partners/customers/, http://lg.angonix.net, 16, 3200000, 281
545, Africa, Angola, Luanda, Ponto de Intercambio Internet Angola, Planned, Ethernet, Association, 0, http://www.aapsi.og.ao/index.php/infraestruturas/ponto-de-intercambio-internet, , , 0, 0, 0
1403, Latin America, Argentina, Bahía Blanca, NAP CABASE Bahía Blanca, Active, , Association, 20130427, http://www.cabase.org.ar/wordpress/nap-bahia-blanca-2/, http://www.cabase.org.ar/wordpress/nap-bahia-blanca-2/, , 15, 713000, 0
1822, Latin America, Argentina, Bariloche, NAP CABASE Bariloche, Active, Ethernet, Association, 20140915, http://www.cabase.org.ar/, http://www.cabase.org.ar/nap-bariloche/, , 6, 0, 0
2, Latin America, Argentina, Buenos Aires, NAP CABASE Buenos Aires, Active, Ethernet, Association, 19980401, http://www.cabase.org.ar, http://www.cabase.org.ar/eng/asociados/asociados_completo.php, http://trafico.cabase.org.ar/lg, 71, 974000, 15972
1404, Latin America, Argentina, Córdoba, NAP CABASE Córdoba, Active, Ethernet, Association, 20120424, http://www.cabase.org.ar/wordpress/nap-cordoba/, http://www.cabase.org.ar/wordpress/nap-cordoba/, , 22, 175000, 10737
1406, Latin America, Argentina, La Plata, NAP CABASE La Plata, Active, Ethernet, Association, 20120606, http://www.cabase.org.ar/wordpress/nap-la-plata/, http://www.cabase.org.ar/wordpress/nap-la-plata/, , 13, 85000, 0
1407, Latin America, Argentina, Mar del Plata, NAP CABASE Mar del Plata, Active, Ethernet, Association, 20121107, http://www.cabase.org.ar/wordpress/nap-mar-del-plata/, http://www.cabase.org.ar/wordpress/nap-mar-del-plata/, , 10, 968000, 0
1405, Latin America, Argentina, Mar del Tuyú, NAP CABASE De la Costa, Active, Ethernet, Association, 20111129, http://www.cabase.org.ar/wordpress/nap-de-la-costa/, http://www.cabase.org.ar/wordpress/nap-de-la-costa/, , 8, 919000, 0
1408, Latin America, Argentina, Mendoza, NAP CABASE Mendoza, Active, Ethernet, Association, 20111020, http://www.cabase.org.ar/wordpress/nap-mendoza/, http://www.cabase.org.ar/wordpress/nap-mendoza/, , 13, 2160000, 0
1198, Latin America, Argentina, Neuquén, NAP CABASE Neuquén, Active, Ethernet, Association, 20100510, http://www.cabase.org.ar/wordpress/nap-neuquen/, http://www.cabase.org.ar/wordpress/nap-neuquen/, , 17, 2210000, 10706
1820, Latin America, Argentina, Posadas, NAP CABASE Posadas, Active, Ethernet, Association, 20131128, http://www.cabase.org.ar/wordpress/nap-posadas/, , , 12, 627000, 0
1823, Latin America, Argentina, Puerto Madryn, NAP CABASE Puerto Madryn, Active, Ethernet, Association, 20141030, http://www.cabase.org.ar/wordpress/nap-puerto-madryn/, , , 7, 0, 0
1409, Latin America, Argentina, Rosario, NAP CABASE Rosario, Active, Ethernet, Association, 20110331, http://www.cabase.org.ar/wordpress/nap-rosario/, http://www.cabase.org.ar/wordpress/nap-rosario/, , 17, 2290000, 0
1410, Latin America, Argentina, Santa Fe, NAP CABASE Santa Fe, Active, Ethernet, Association, 20111122, http://www.cabase.org.ar/wordpress/nap-santa-fe/, http://www.cabase.org.ar/wordpress/nap-santa-fe/, , 6, 122000, 0
1, Latin America, Argentina, Buenos Aires, Cubecorp, Not an exchange, Ethernet, Commercial, 0, http://www.cubecorp.com.ar/, , , 0, 0, 0
1817, Latin America, Argentina, Buenos Aires, NAP CABASE La Matanza, Planned, Ethernet, Association, 0, , , , 0, 0, 0
1818, Latin America, Argentina, Corrientes, NAP CABASE Corrientes, Planned, Ethernet, Association, 0, , , , 0, 0, 0
1821, Latin America, Argentina, Parana, NAP CABASE Parana, Planned, Ethernet, Association, 0, , , , 0, 0, 0
1819, Latin America, Argentina, Resistencia, NAP CABASE Resistencia, Planned, Ethernet, Association, 0, , , , 0, 0, 0
1499, Europe, Armenia, Yerevan, Armenian Internet Traffic Exchange, Active, Ethernet, Association, 20100000, http://www.armix.am/, http://www.armix.am/eng/members.php, , 9, 0, 0
387, Asia-Pacific, Australia, Adelaide, PIPE Networks Adelaide, Active, Ethernet, Commercial, 20030000, http://www.pipenetworks.com, http://www.pipenetworks.com/Peering/who.shtml#SouthAustralia, http://lg.pipenetworks.com/#NOTICE-USE-SA-ROUTER, 13, 0, 0
1473, Asia-Pacific, Australia, Adelaide, South Australia Internet Exchange, Active, Ethernet, Association, 20130227, http://www.ix.asn.au/peering.html, http://www.ix.asn.au/peering-peers-saix.html, http://monitor.qld.ix.asn.au/ulg/, 12, 799790, 0
13, Asia-Pacific, Australia, Brisbane, PIPE Networks Brisbane, Active, Ethernet, Commercial, 20020500, http://www.pipenetworks.com, http://www.pipenetworks.com/Peering/who.shtml#Queensland, http://lg.pipenetworks.com/#NOTICE-USE-QLD-ROUTER, 36, 0, 0
1472, Asia-Pacific, Australia, Brisbane, Queensland Internet Exchange, Active, Ethernet, Association, 20110000, http://www.ix.asn.au/peering.html, http://www.ix.asn.au/peering-peers-qldix.html, http://monitor.nsw.ix.asn.au/ulg/, 30, 14010000, 0
1008, Asia-Pacific, Australia, Canberra, ACT Internet Exchange, Active, Ethernet, Association, 20081001, http://www.actix.net.au, http://www.actix.net.au/about.html, , 7, 1000000, 0
400, Asia-Pacific, Australia, Canberra, PIPE Networks Canberra, Active, Ethernet, Commercial, 20040600, http://www.pipenetworks.com, http://www.pipenetworks.com/Peering/who.shtml#AustralianCapitalTerritory, , 2, 0, 0
388, Asia-Pacific, Australia, Hobart, PIPE Networks Hobart, Active, Ethernet, Commercial, 20030800, http://www.pipenetworks.com, http://www.pipenetworks.com/Peering/who.shtml#Tasmania, http://lg.pipenetworks.com/#NOTICE-USE-TAS-ROUTER, 1, 0, 0
6, Asia-Pacific, Australia, Melbourne, AUSIX, Active, Ethernet, Commercial, 20010700, http://www.ausix.net/, , , 7, 20000, 0
389, Asia-Pacific, Australia, Melbourne, PIPE Networks Melbourne, Active, Ethernet, Commercial, 20030700, http://www.pipenetworks.com, http://www.pipenetworks.com/Peering/who.shtml#Victoria, http://lg.pipenetworks.com/#NOTICE-USE-VIC-ROUTER, 32, 0, 0
8, Asia-Pacific, Australia, Melbourne, Victoria Internet Exchange, Active, Ethernet, Association, 20110000, http://www.ix.asn.au/peering.html, http://www.ix.asn.au/peering-peers-vicix.html, http://monitor.vic.ix.asn.au/ulg/, 49, 44920000, 0
9, Asia-Pacific, Australia, Perth, Western Australian Internet Association, Active, Ethernet, Association, 19970000, http://www.ix.asn.au/peering.html, http://www.ix.asn.au/peering-peers-waix.html, http://monitor.wa.ix.asn.au/ulg/, 82, 29740000, 27133
12, Asia-Pacific, Australia, Sydney, Equinix Sydney, Active, Ethernet, Commercial, 20030000, http://www.equinix.com, , , 85, 108000, 54670
1916, Asia-Pacific, Australia, Sydney, Megaport-IX Sydney, Active, Ethernet, Commercial, 0, https://www.megaport.com, https://www.megaport.com/services/ix-connected-networks, https://lg.megaport.com/, 0, 0, 0
1585, Asia-Pacific, Australia, Sydney, New South Wales IX, Active, Ethernet, Association, 20130000, http://www.ix.asn.au/peering.html, https://www.ix.asn.au/peers-nsw/, http://monitor.nsw.ix.asn.au/ulg/, 148, 79850000, 34015
402, Asia-Pacific, Australia, Sydney, PIPE Networks Sydney, Active, Ethernet, Commercial, 20030000, http://www.pipenetworks.com, http://www.pipenetworks.com/Peering/who.shtml#NewSouthWales, http://lg.pipenetworks.com/#NOTICE-USE-NSW-ROUTER, 173, 0, 0
3, Asia-Pacific, Australia, Adelaide, South Australian Internet Exchange, Defunct, Ethernet, Association, 19960700, http://www.saia.asn.au/saix, , , 23, 0, 0
4, Asia-Pacific, Australia, Brisbane, AusBONE-Brisbane Internet Exchange, Defunct, Ethernet, Unknown, 19971000, http://www.ausbone.net/whyisps.htm, , , 0, 0, 0
1851, Asia-Pacific, Australia, Canberra, TransACT IX, Unknown, Ethernet, Commercial, 0, http://www.transact.com.au/en-ACT/wholesale/products/wholesale-ip, , , 0, 0, 0
243, Asia-Pacific, Australia, Hobart, Tasmanian Internet Exchange, Defunct, , , 0, http://www.tia.asn.au/, , , 0, 0, 0
807, Asia-Pacific, Australia, Lismore, lismore internet exchange, Unknown, , Unknown, 0, , , , 0, 0, 0
5, Asia-Pacific, Australia, Melbourne, AusBONE-Melbourne Internet Exchange, Defunct, Ethernet, Unknown, 19970000, http://www.ausbone.net/whyisps.htm, , , 0, 0, 0
748, Asia-Pacific, Australia, Melbourne, AUSIX.net, Unknown, , Commercial, 20020000, http://www.ausix.net/, , , 0, 0, 0
7, Asia-Pacific, Australia, Melbourne, Melbourne NAPette, Defunct, ISDN, Unknown, 19990400, http://peer.sensation.net.au/, , , 5, 0, 0
10, Asia-Pacific, Australia, Sydney, AusBONE-Sydney Internet Exchange, Defunct, Ethernet, Unknown, 19971000, http://www.ausbone.net/whyisps.htm, , , 0, 0, 0
1850, Asia-Pacific, Australia, Sydney, Pacific-IX, Unknown, Ethernet, Commercial, 0, http://www.vocus.com.au/pacificix/, , , 0, 0, 0
11, Asia-Pacific, Australia, Sydney, Pihana Sydney, Not an exchange, , , 0, , , , 0, 0, 0
14, Europe, Austria, Graz, Grazer Internet Exchange, Active, Ethernet, Association, 20100304, http://www.grax.at/, http://www.grax.at/index.html, , 16, 36365, 0
1225, Europe, Austria, Klagenfurt, Alpes Adria Internet Exchange, Active, Ethernet, Association, 20100000, http://www.aaix.at/, http://www.aaix.at/, , 12, 150000, 184
1896, Europe, Austria, Salzburg, Salzburg Internet eXchange, Active, Ethernet, Association, 20150515, https://www.saix.at, https://www.saix.at/members.html, https://www.saix.at/lg, 22, 40000, 0
15, Europe, Austria, Vienna, Vienna Internet Exchange, Active, Ethernet, University, 19960400, http://www.VIX.at/, http://www.vix.at/vix_participants.html, http://www.vix.at/vix_lookingglass.html, 124, 318040000, 145453
1710, Europe, Azerbaijan, Baku, Azerbaijan Internet exchange, Not an exchange, Ethernet, Unknown, 20130000, , , , 0, 0, 0
1065, Europe, Bahrain, Manama, Gateway Gulf Internet Exchange Bahrain, Active, Ethernet, Commercial, 20090401, http://www.gatewaygulf.bh, , , 3, 0, 23
1117, Europe, Bahrain, Manama, Bahrain Internet Exchange, Not an exchange, Layer-3, Association, 20030813, http://www.bix.bh/, , , 0, 0, 0
16, Asia-Pacific, Bangladesh, Dhaka, Bangladesh Internet Exchange, Active, Ethernet, Association, 20040826, http://www.bdix.net/, http://www.bdix.net/member_list.htm, https://prefix.pch.net/applications/lg/, 31, 11094433, 4640
739, Asia-Pacific, Bangladesh, Dhaka, Bangladesh Society of Internet Exchange, Active, Ethernet, Association, 20040500, http://www.bsixbd.net/news.php, , , 0, 0, 0
1812, Europe, Belarus, Minsk, Belarus National Internet Exchange Point, Unknown, , Governmental, 0, , , , 0, 0, 0
17, Europe, Belgium, Brussels, Belgian National Internet Exchange, Active, Ethernet, Governmental, 19950000, http://www.bnix.net/, http://www.bnix.net/members.php, , 57, 140000000, 0
18, Europe, Belgium, Brussels, Free Belgian Internet Exchange, Defunct, Ethernet, Association, 20030904, http://www.freebix.net/, http://www.freebix.net/members, , 22, 0, 0
1918, Latin America, Belize, Belize City , Belize Internet Exchange Point, Active, Ethernet, Association, 20160427, , , , 0, 0, 150
1838, Africa, Benin, Cotonou, Benin IX, Active, Ethernet, Association, 20131200, http://www.benin-ix.org.bj, , , 6, 951784, 141
1530, Latin America, Bolivia, La Paz, IX-LAPAZ, Active, Ethernet, Commercial, 20131101, https://ixp.megalink.com/, https://ixp.megalink.com/participantes.php, , 4, 1000, 322
1789, Latin America, Bolivia, La Paz, Punto de Intercambio de Trafico de Bolivia, Active, Ethernet, Association, 20131113, , , , 6, 175000, 0
1006, Latin America, Bolivia, Santa Cruz, IX de Bolivia, Defunct, Ethernet, Association, 20120000, , , , 0, 0, 0
367, Africa, Botswana, Gaborone, Botswana Internet Exchange, Active, Ethernet, Association, 20051000, http://www.info.bw/bispa/binx.html, http://www.info.bw/bispa/binx.html, , 14, 1000000, 0
1440, Latin America, Brazil, Belém, Ponto de Troca de Trafego do Belém, Active, Ethernet, Association, 20110600, http://ptt.br/adesao/bel, http://ptt.br/particip/bel, , 16, 518650, 0
19, Latin America, Brazil, Belo Horizonte, Ponto de Troca de Tráfego do Belo Horizonte, Active, Ethernet, Association, 20100100, http://ptt.br/adesao/mg/, http://ptt.br/particip/mg, , 39, 6300000, 0
20, Latin America, Brazil, Brasília, Ponto de Troca de Tráfego do Brasília, Active, Ethernet, Association, 20090000, http://ptt.br/adesao/df, http://ptt.br/particip/df, , 35, 8290000, 0
1275, Latin America, Brazil, Campina Grande, Ponto de Troca de Trafego do Campina Grande, Active, Ethernet, Association, 20100928, http://ptt.br/adesao/cpv, http://ptt.br/particip/cpv, , 17, 15940000, 0
1199, Latin America, Brazil, Campinas, Ponto de Troca de Trafego do Campinas, Active, Ethernet, Association, 20091130, http://ptt.br/adesao/cas, http://ptt.br/particip/cas, , 36, 29070000, 0
1441, Latin America, Brazil, Caxias do Sul, Ponto de Troca de Trafego do Caxias do Sul, Active, Ethernet, Association, 20130600, http://ptt.br/adesao/cxj, http://ptt.br/particip/cxj, , 5, 213350, 0
1807, Latin America, Brazil, Cuiabá, Ponto de Troca de Tráfego do Cuiabá, Active, Ethernet, Association, 20140700, http://ptt.br/adesao/cgb, http://ptt.br/particip/cgb, , 13, 89920, 0
1832, Latin America, Brazil, Curitiba, Ponto de Troca de Trafego do Curitiba, Active, Ethernet, Governmental, 20070000, http://ptt.br/adesao/pr, http://ptt.br/particip/pr, , 71, 53100000, 0
22, Latin America, Brazil, Florianópolis, Ponto de Troca de Tráfego do Florianópolis, Active, Ethernet, Association, 20080000, http://ptt.br/adesao/ce, http://ptt.br/particip/sc, , 35, 4020000, 0
1089, Latin America, Brazil, Fortaleza, Ponto de Troca de Trafego do Fortaleza, Active, Ethernet, Association, 20081001, http://ptt.br/adesao/ce, http://ptt.br/particip/ce, , 32, 9080000, 0
1276, Latin America, Brazil, Goiânia, Ponto de Troca de Trafego do Goiânia, Active, Ethernet, Association, 20101020, http://ptt.br/adesao/gyn, http://ptt.br/particip/gyn, , 23, 2270000, 0
1808, Latin America, Brazil, Lajeado, Ponto de Troca de Trafego do Lajeado, Active, Ethernet, Association, 20130300, http://ptt.br/adesao/laj, http://ptt.br/particip/laj, , 13, 860930, 0
1088, Latin America, Brazil, Londrina, Ponto de Troca de Trafego do Londrina, Active, Ethernet, Association, 20090215, http://ptt.br/adesao/lda, http://ptt.br/particip/lda, , 27, 9490000, 0
1442, Latin America, Brazil, Manaus, Ponto de Troca de Trafego do Manaus, Active, Ethernet, Association, 20130100, http://ptt.br/adesao/mao, http://ptt.br/particip/mao, , 10, 122680, 0
1833, Latin America, Brazil, Maringá, Ponto de Troca de Trafego do Maringa, Active, Ethernet, Governmental, 20131100, http://ptt.br/adesao/mgf, http://ptt.br/particip/mgf, , 25, 2810000, 0
1443, Latin America, Brazil, Natal, Ponto de Troca de Trafego do Natal, Active, Ethernet, Association, 20110600, http://ptt.br/adesao/nat, http://ptt.br/particip/nat, , 14, 1450000, 0
21, Latin America, Brazil, Paraná, Ponto de Troca de Tráfego do Paraná, Active, Ethernet, University, 20020600, http://ptt.br/adesao/pr, http://ptt.br/particip/pr, , 71, 53100000, 0
1092, Latin America, Brazil, Porto Alegre, Ponto de Troca de Trafego do Porto Alegre, Active, Ethernet, Association, 20020400, http://ptt.br/adesao/rs, http://ptt.br/particip/rs, , 141, 159460000, 0
1200, Latin America, Brazil, Recife, Ponto de Troca de Trafego do Recife, Active, Ethernet, Association, 20091201, http://ptt.br/adesao/pe, http://ptt.br/particip/pe, , 24, 4100000, 0
415, Latin America, Brazil, Rio de Janeiro, Ponto de Troca de Tráfego do Rio de Janeiro, Active, Ethernet, Association, 20100000, http://ptt.br/adesao/rj, http://ptt.br/particip/rj, , 108, 225350000, 0
1018, Latin America, Brazil, Salvador, Ponto de Troca de Trafego do Salvador, Active, Ethernet, Association, 20080000, http://ptt.br/adesao/ba, http://ptt.br/particip/ba, , 49, 5160000, 0
1809, Latin America, Brazil, São Carlos, Ponto de Troca de Trafego do Central Paulista , Active, Ethernet, Association, 20131000, http://ptt.br/adesao/sca, http://ptt.br/particip/sca, , 4, 7410, 0
1445, Latin America, Brazil, São José do Rio Preto, Ponto de Troca de Trafego do São José do Rio Preto, Active, Ethernet, Association, 20130100, http://ptt.br/adesao/sjp, http://ptt.br/particip/sjp, , 11, 762890, 0
1444, Latin America, Brazil, São José dos Campos, Ponto de Troca de Trafego do São José dos Campos, Active, Ethernet, Association, 20110000, http://ptt.br/adesao/sjc, http://ptt.br/particip/sjc, , 13, 170410, 0
29, Latin America, Brazil, São Paulo, NAP do Brasil, Active, Ethernet, Commercial, 19980000, http://www.verizonenterprise.com/infrastructure/data-centers/latin-america/nap-do-brazil/, , , 37, 20000000, 0
30, Latin America, Brazil, São Paulo, Ponto de Troca de Tráfego Metro São Paulo, Active, Ethernet, Association, 20041004, http://ptt.br/adesao/sp, http://ptt.br/particip/sp, , 817, 1886180000, 0
1446, Latin America, Brazil, Vitória, Ponto de Troca de Trafego do Vitória, Active, Ethernet, Association, 20120000, http://ptt.br/adesao/vix, http://ptt.br/particip/vix, , 25, 380400, 0
1109, Latin America, Brazil, , LNCC, Unknown, Ethernet, Unknown, 0, http://www.lncc.br/frame.html, , , 0, 0, 0
1274, Latin America, Brazil, Americana, Ponto de Troca de Trafego do Americana, Unknown, Ethernet, Association, 20101220, http://ptt.br/adesao/ame/, http://ame.ptt.br/particip.html, , 12, 572040, 0
23, Latin America, Brazil, Porto Alegre, Rio Grande do Sul Internet Exchange, Deprecated, Ethernet, Unknown, 20001120, http://rs.ptt.br/, , , 19, 76821000, 0
24, Latin America, Brazil, Rio De Janeiro, Optiglobe Internet Exchange - Latin America, Defunct, Ethernet, Unknown, 0, , , , 0, 0, 0
1110, Latin America, Brazil, São Paulo, An Academic Network at Sao Paulo, Not an exchange, Ethernet, Governmental, 0, http://www.ansp.br/, http://www.ansp.br/index.php/us/participants, http://lg.ansp.br/lgform.cgi, 48, 0, 0
25, Latin America, Brazil, São Paulo, Daedalus, Defunct, , , 0, , , , 0, 0, 0
26, Latin America, Brazil, São Paulo, Diveo NAP, Not an exchange, ATM, , 0, , , , 0, 0, 0
27, Latin America, Brazil, São Paulo, NAP Abranet (Not an exchange), Not an exchange, , , 0, , , , 0, 0, 0
31, Latin America, Brazil, São Paulo, Telcomp, Defunct, Ethernet, Unknown, 20030000, http://www.telcomp.org.br/, , , 5, 75000, 0
28, Latin America, Brazil, São Paulo, Tivit, Defunct, Ethernet, Commercial, 0, http://www2.tivit.com.br/internet2/, , , 39, 0, 0
1299, Latin America, British Virgin Islands, Road Town, British Virgin Islands IXP, Planned, Ethernet, Association, 0, , , , 0, 0, 0
1194, Europe, Bulgaria, Sofia, Balkan Internet Exchange, Active, Ethernet, Association, 20100000, http://www.b-ix.net, http://www.b-ix.net/members/peers/, http://lg.b-ix.net/, 41, 166960000, 0
1137, Europe, Bulgaria, Sofia, Bulgarian Internet eXchange, Active, Ethernet, Commercial, 20090801, http://www.bix.bg/en/, http://www.bix.bg/en/bix.bg_members.html, http://lg.bix.bg/, 66, 120260000, 165008
1623, Europe, Bulgaria, Sofia, NetIX, Active, Ethernet, Commercial, 20130101, http://www.netix.net, http://netix.net/members, http://lg.netix.bg/, 91, 233920000, 982145
1892, Europe, Bulgaria, Sofia, T-CIX, Active, Ethernet, Commercial, 20150518, http://www.t-cix.net, http://www.t-cix.net/index.php?page=members&lang=eng, http://www.t-cix.net/lg/lg.cgi, 20, 0, 153861
32, Europe, Bulgaria, Sofia, GoCIS, Unknown, , , 0, , , , 0, 0, 0
33, Europe, Bulgaria, Sofia, Sofia Internet Exchange, Unknown, , , 0, , , , 0, 0, 0
499, Europe, Bulgaria, Varna, Varna Internet Exchange, Unknown, , Unknown, 0, , , , 0, 0, 0
1839, Africa, Burkina Faso, Ouagadougou, Burkina Faso IXP, Active, , Association, 20150626, www.bfix.bf, , , 8, 0, 0
546, Africa, Burundi, Bujumbura, BurundiX Internet Exchange Point, Active, Ethernet, Association, 20140321, http://www.burundix.bi, , , 1, 81, 0
1906, Asia-Pacific, Cambodia, Phnom Penh, Cambodian Network Exchange, Active, Ethernet, Association, 20081201, http://cnx.net.kh/, http://cnx.net.kh/member/, , 24, 2600000, 0
1526, Asia-Pacific, Cambodia, Phnom Penh, HTN-Cambodia Internet Exchange, Active, , Commercial, 20130000, http://www.htnetworks.com.kh/index.php/ixservices, , , 9, 0, 0
34, Asia-Pacific, Cambodia, Phnom Penh, Finder Internet Exchange, Defunct, Ethernet, Association, 20030600, http://www.finder.com.kh/, , , 4, 3000, 0
1669, North America, Canada, Calgary, AlbertaIX, Active, Ethernet, University, 20140123, https://www.albertaix.ca/, https://www.albertaix.ca/peers/, , 3, 0, 0
1461, North America, Canada, Calgary, Calgary Internet Exchange, Active, Ethernet, Association, 20130000, http://www.yycix.ca, http://yycix.ca/peers.html, , 25, 784280, 155356
1693, North America, Canada, Halifax, Halifax Internet Exchange, Active, Ethernet, Association, 20131125, http://hfxix.ca, http://hfxix.ca/peering-lan-ip-assignments/, , 12, 0, 118
1616, North America, Canada, Montreal, Quebec Internet Exchange, Active, Ethernet, Association, 20130100, http://www.qix.ca, http://www.qix.ca/en/members/membership, , 48, 32220000, 93714
37, North America, Canada, Ottawa, Ottawa Internet Exchange, Active, Ethernet, Association, 20010410, http://www.ottix.net/, http://www.ottix.net/peers.html, http://www.ottix.net/cgi-bin/lg.pl, 14, 69666, 987
39, North America, Canada, Toronto, Toronto Internet Exchange, Active, Ethernet, Association, 19980000, http://www.torix.net/, http://www.torix.net/peers.php, , 197, 282254000, 110607
1802, North America, Canada, Vancouver, Vancouver Internet Exchange, Active, Ethernet, Association, 20131130, http://www.vanix.ca, http://www.vanix.ca/participants/, , 54, 16500000, 0
1316, North America, Canada, Winnipeg, Manitoba Internet Exchange, Active, Ethernet, Association, 20130729, http://www.mbix.ca, http://www.mbix.ca/peers/, , 22, 740000, 154973
1540, North America, Canada, Winnipeg, Winnipeg Internet Exchange, Active, Ethernet, Association, 20130500, http://www.wpgix.net, http://wpgix.net/?page_id=13, , 25, 3860000, 92293
35, North America, Canada, Edmonton, Edmonton Internet Exchange, Defunct, , Unknown, 0, http://www.eix.net/, , , 7, 0, 0
1882, North America, Canada, Edmonton, YEGIX Edmonton Internet Exchange, Planned, Ethernet, Association, 0, www.yegix.ca, , , 0, 0, 0
1195, North America, Canada, Montreal, Peer1 Internet Exchange - Montreal, Not an exchange, Ethernet, Commercial, 20100000, http://www.peer1.com/infrastructure/pix, http://www.peer1.com/infrastructure/participants, , 0, 0, 0
36, North America, Canada, Montreal, Quebec Internet Exchange/RISQ, Not an exchange, Layer-3, Unknown, 0, http://www.risq.qc.ca/reseau/architecture/archi_section.php?LANG=EN&S=qix, , , 11, 0, 0
38, North America, Canada, Toronto, CANIX, Defunct, , Unknown, 0, http://www.canix.ca/toronto.php, http://www.canix.ca/toronto.php, , 0, 0, 0
1852, North America, Canada, Toronto, Equinix Toronto, Unknown, Ethernet, Commercial, 0, http://www.equinix.com//locations/canada-colocation/toronto-data-center/tr1, , , 0, 0, 0
1554, North America, Canada, Toronto, Greater Toronto International Internet Exchange, Not an exchange, Ethernet, Commercial, 20110600, http://www.iixpeering.net/peering/gtiix.php, http://www.iixpeering.net/peering/about-members.php, , 10, 0, 0
974, North America, Canada, Toronto, Peer1 Internet Exchange - Toronto, Not an exchange, Ethernet, Commercial, 20080000, http://www.peer1.com/infrastructure/pix, http://www.peer1.com/infrastructure/participants, , 7, 0, 0
40, North America, Canada, Vancouver, British Columbia Internet Exchange, Not an exchange, , Unknown, 0, http://www.bcix.net/, http://www.bcix.net/member_info/membership_categories.htm, , 0, 0, 0
975, North America, Canada, Vancouver, Peer1 Internet Exchange - Vancouver, Not an exchange, Ethernet, Commercial, 20080000, http://www.peer1.com/infrastructure/pix, http://www.peer1.com/infrastructure/participants, , 25, 0, 0
1672, North America, Canada, Victoria, Victoria Transit Exchange, , Layer-3, University, 0, , , , 0, 0, 0
41, Latin America, Chile, Santiago, NAP Chile, Active, , Governmental, 19970900, http://www.nap.cl/, http://www.nap.cl/f_proveedores.html, http://pit.nap.cl/cgi-bin/lg.cgi, 13, 0, 0
42, Latin America, Chile, , Chile Network Access Point, Unknown, , , 0, , , , 0, 0, 0
43, Asia-Pacific, China, Beijing, Beijing National Internet Exchange Center, Active, Ethernet, Governmental, 20000400, , , , 11, 2000000, 0
1913, Asia-Pacific, China, Beijing, CHN IX, Active, Ethernet, Commercial, 20151201, http://www.chn-ix.net, , , 2, 0, 0
1926, Asia-Pacific, China, Beijing, CNIX China Internet Exchange, Active, Ethernet, Commercial, 20150300, www.cnix.com.cn, , , 1, 0, 0
1319, Asia-Pacific, China, Hong Kong, AMS-IX Hong Kong, Active, Ethernet, Association, 20120401, http://www.ams-ix.hk, http://www.ams-ix.hk/connected_parties, , 28, 19104000, 0
1836, Asia-Pacific, China, Hong Kong, BBIX Hong Kong, Active, Ethernet, Commercial, 20141001, www.bbix.net, , , 0, 0, 0
834, Asia-Pacific, China, Hong Kong, Equinix Hong Kong, Active, Ethernet, Commercial, 20090000, http://www.equinix.hk, , , 0, 0, 0
