1795, North America, United States, Bend, Central Oregon Internet eXchange, Active, Ethernet, Association, 20110512, http://www.centraloregonix.org, http://www.centraloregonix.org/members/, , 4, 0, 0
703, North America, United States, Billings, Yellowstone Regional Internet Exchange, Active, Ethernet, Association, 20030000, http://www.yrix.org, http://www.yrix.org/participants.php, , 8, 0, 0
1348, North America, United States, Boston, Boston Internet Exchange, Active, Ethernet, Association, 20120409, http://markleygroup.com/Peering, http://markleygroup.com/Peering, , 48, 0, 89404
1719, North America, United States, Boston, Coresite - Any 2, Active, Ethernet, Commercial, 20130000, http://www.coresite.com/solutions/interconnection/Peering-Exchanges/ANY2, http://www.coresite.com/solutions/interconnection/Peering-Exchanges/ANY2/ANY2-Peering-Participants, , 0, 0, 0
266, North America, United States, Boston, Equinix-Boston, Active, Ethernet, Commercial, 20000720, http://www.switchanddata.com/subpages/PAIX_services.asp, , , 0, 0, 0
1553, North America, United States, Buffalo, Buffalo Niagara International Internet Exchange, Active, Ethernet, Commercial, 20110500, http://www.iixpeering.net/peering/bniix.php, http://www.iixpeering.net/peering/about-members.php, , 8, 0, 0
1871, North America, United States, Carrolton, CyrusOne, Active, Ethernet, Commercial, 20110000, http://www.cyrusone.com/data-center-technology-features/cyrusone-national-ix-internet-exchange/interconnection-peering-exchange/, , , 0, 0, 0
1869, North America, United States, Cheyenne, Big Horn Fiber, Active, Ethernet, Commercial, 20130000, http://www.bighornfiber.com, http://www.bighornfiber.com/about-us/participants/, , 12, 0, 0
1847, North America, United States, Chicago, AMS-IX Chicago, Active, Ethernet, Association, 20141007, https://chi.ams-ix.net, https://chi.ams-ix.net/connected_parties, , 12, 15143000, 92372
928, North America, United States, Chicago, CoreSite - Any2, Active, Ethernet, Commercial, 20080100, http://www.coresite.com/chicago-data-center.php, http://www.coresite.com/solutions/interconnection/peering-exchanges/any2-internet-peering-exchange/any2-peering-participants, , 7, 5000000, 0
268, North America, United States, Chicago, Equinix Chicago IBX, Active, Ethernet, Commercial, 20020304, http://peering.equinix.com/, , , 36, 0, 381877
1555, North America, United States, Chicago, Greater Chicago International Internet Exchange, Active, Ethernet, Commercial, 20121200, http://www.iixpeering.net/peering/gciix.php, http://www.iixpeering.net/peering/about-members.php, , 2, 0, 0
271, North America, United States, Chicago, STAR TAP, Active, Ethernet, University, 19980000, http://www.startap.net/ENGINEERING/IPPLAN.html, http://www.startap.net/NETWORKS/, , 31, 0, 0
272, North America, United States, Chicago, StarLight, Active, Ethernet, University, 20010300, http://www.startap.net/starlight/ENGINEERING/engIPadds.html, http://www.startap.net/starlight/NETWORKS/, , 34, 0, 0
1883, North America, United States, Chicago, United IX Chicago, Active, Ethernet, Commercial, 20140000, https://unitedix.net/, https://unitedix.net/location/chicago/networks, , 18, 0, 0
278, North America, United States, Dallas, Equinix IBX Dallas, Active, Ethernet, Commercial, 20010615, http://www.equinix.net, , , 0, 0, 0
282, North America, United States, Dallas, Equinix-Dallas(former PAIX), Active, Ethernet, Commercial, 20020224, http://www.switchanddata.com/Dallas%5Fcolocation/, , , 0, 0, 0
1206, North America, United States, Dallas, TelX Internet Exchange, Active, Ethernet, Commercial, 20070000, https://tie.telx.com/, https://tie.telx.com/participants/, , 14, 45, 0
586, North America, United States, Dayton, Dayton Metro Internet Exchange, Active, Ethernet, Association, 20030624, http://www.donet.com/~dmix/, http://www.donet.com/~dmix/, , 4, 0, 0
1720, North America, United States, Denver, Coresite - Any 2, Active, Ethernet, Commercial, 20130000, http://www.coresite.com/solutions/interconnection/Peering-Exchanges/ANY2, http://www.coresite.com/solutions/interconnection/Peering-Exchanges/ANY2/ANY2-Peering-Participants, , 32, 0, 0
1905, North America, United States, Detroit, DET-IX, Active, Ethernet, Association, 20150331, http://www.detroitix.com, http://www.detroitix.com/#section-4, , 17, 21671000, 0
1876, North America, United States, Duluth, Twin Ports Internet Exchange, Active, Ethernet, Commercial, 20121101, www.tp-ix.net, , , 0, 0, 0
1267, North America, United States, Guam, Guam Internet Exchange, Active, , Association, 20110000, http://www.gu-ix.net/, http://www.gu-ix.net/members.html, , 3, 1000000, 0
592, North America, United States, Honolulu, DRFxchange, Active, Ethernet, Commercial, 20070108, http://www.drfortress.com/internet-exchange/drfxchange/, , , 14, 0, 0
287, North America, United States, Honolulu, Hawaii Internet Exchange, Active, Ethernet, University, 19950700, http://www.hawaii.edu/hix/, http://www.hawaii.edu/hix/Hawaii_Internet_Exchange/Networks.html, , 8, 0, 1130
288, North America, United States, Houston, Houston Network Access Point, Active, , Commercial, 20100000, http://www.houston-nap.com/index.html, , , 0, 0, 0
292, North America, United States, Houston, Rice EduPOP, Active, , University, 20010510, , , , 0, 0, 0
354, North America, United States, Houston, Texas GigaPOP, Active, Ethernet, University, 19970000, http://www.gigapop.gen.tx.us/, , , 0, 0, 0
1891, North America, United States, Indianapolis, Midwest-IX, Active, Ethernet, Association, 20150000, http://www.midwest-ix.com, http://www.midwest-ix.com/members.html, , 17, 0, 709
1317, North America, United States, Jacksonville, Jacksonville Internet Exchange, Active, Ethernet, Association, 20120102, http://jxix.org, http://jxix.org/index.php?page=participants, , 9, 0, 184
630, North America, United States, Kansas City, Kansas City Internet Exchange, Active, Ethernet, Association, 20060000, http://www.kcix.net/, http://www.kcix.net/members.html, , 26, 0, 0
373, North America, United States, Los Angeles, Any2 California, Active, Ethernet, Commercial, 20051200, http://www.coresite.com/, http://www.coresite.com/solutions/interconnection/Peering-Exchanges/ANY2/ANY2-Peering-Participants, , 449, 68000000, 433632
1870, North America, United States, Los Angeles, CENIC International Internet eXchange, Active, Ethernet, University, 19960000, http://www.ciix.net, http://www.ciix.net/participants/, , 6, 0, 0
467, North America, United States, Los Angeles, Equinix Los Angeles IBX, Active, Ethernet, Commercial, 20020711, http://www.equinix.com/, , , 0, 0, 196852
297, North America, United States, Los Angeles, Los Angeles International Internet Exchange, Active, Ethernet, Commercial, 19960000, http://www.laiix.net/, http://www.laiix.net/index.php?core=members.php, , 39, 8800000, 117076
303, North America, United States, Madison, Madison Internet Exchange, Active, ATM,Ethernet, University, 20000000, http://kb.wisc.edu/ns/page.php?id=6636, http://kb.wisc.edu/ns/page.php?id=6636#Current%20Members, , 21, 0, 0
1077, North America, United States, Massachusetts, Massachusetts Internet Exchange, Active, , Unknown, 20150514, http://mass-ix.net/, http://mass-ix.net/#participants, , 28, 3400000, 0
1680, North America, United States, Medford, Southern Oregon Access Exchange, Active, Ethernet, Commercial, 20130000, http://www.soax.org, http://www.soax.org/index.php/members, , 5, 0, 0
1721, North America, United States, Miami, Coresite - Any 2, Active, Ethernet, Commercial, 20130000, http://www.coresite.com/solutions/interconnection/Peering-Exchanges/ANY2, http://www.coresite.com/solutions/interconnection/Peering-Exchanges/ANY2/ANY2-Peering-Participants, , 0, 0, 0
308, North America, United States, Miami, Equinix-Miami, Active, Ethernet, Commercial, 20121203, , , , 0, 0, 0
307, North America, United States, Miami, NAP of the Americas, Active, Ethernet, Commercial, 20040812, http://www.terremark.com/, , , 78, 250000000, 418018
1845, North America, United States, Miami, South Florida Internet Exchange, Active, Ethernet, Association, 20140000, http://fl-ix.net, http://www.communityix.org/index.php/about-fl-ix/fl-ix-networks/, , 72, 90000000, 0
1816, North America, United States, Milwaukee, Milwaukee Internet Exchange, Active, Ethernet, Association, 20110000, www.mkeix.net, http://www.mkeix.net/participants/, , 14, 680000, 0
1265, North America, United States, Minneapolis, Midwest Internet Cooperative Exchange, Active, Ethernet, Association, 20110111, http://www.micemn.net, http://www.micemn.net/participants.html, , 39, 168030000, 0
315, North America, United States, New Jersey, MAGPI Gigapop, Active, , University, 20060000, http://www.magpi.org/, , , 0, 0, 0
1810, North America, United States, New York, AMS-IX New York, Active, Ethernet, Association, 20140417, https://nynj.ams-ix.net/, , , 13, 6492000, 0
321, North America, United States, New York, Big Apple Peering Exchange, Active, Ethernet, Association, 20010000, http://www.ny6ix.net/, http://www.ny6ix.net/, , 25, 0, 0
1722, North America, United States, New York, Coresite - Any 2, Active, Ethernet, Commercial, 20130000, http://www.coresite.com/solutions/interconnection/Peering-Exchanges/ANY2, http://www.coresite.com/solutions/interconnection/Peering-Exchanges/ANY2/ANY2-Peering-Participants, , 0, 0, 0
1778, North America, United States, New York, DE-CIX New York, Active, Ethernet, Commercial, 20130000, http://nyc.de-cix.net/, http://nyc.de-cix.net/participants/, , 122, 95300000, 331901
317, North America, United States, New York, Equinix New York IBX, Active, Ethernet, Commercial, 20030311, http://www.equinix.com/, http://www.equinix.com/company/customers, , 0, 0, 0
323, North America, United States, New York, Equinix-NY(former Paix), Active, Ethernet, Commercial, 20000314, www.equinix.com, , , 0, 0, 151894
320, North America, United States, New York, New York International Internet Exchange, Active, Ethernet, Commercial, 19960000, http://www.nyiix.net/, http://www.nyiix.net/index.php?core=members.php, , 163, 380000000, 148
587, North America, United States, New York, Peer 1 Internet Exchange, Active, Ethernet, Commercial, 20040109, http://www.peer1.net/en/otherservices.asp, , , 0, 0, 0
1149, North America, United States, New York, TelX Internet Exchange, Active, Ethernet, Commercial, 20090000, http://tie.telx.com, http://tie.telx.com/participants/, , 76, 65047500, 148
1678, North America, United States, North-Virginia, LINX NoVa, Active, Ethernet, Association, 20140300, https://www.linx.net/pubtools/topology.html?setlan=nov, https://www.linx.net/pubtools/member-techlist.html, https://www.linx.net/pubtools/looking-glass.html, 21, 1946000, 0
1900, North America, United States, Omaha, OmahaIX, Active, Ethernet, Association, 20140100, http://www.omahaix.com, http://www.omahaix.com/?page=participants&v=all, , 15, 23120000, 0
325, North America, United States, Palo Alto, Equinix- Palo Alto, Active, Ethernet, Commercial, 19941200, http://www.switchanddata.com/subpages/Public_Peering.asp, , , 0, 41000000, 865161
328, North America, United States, Philadelphia, The Philadelphia Internet Exchange, Active, Ethernet, Commercial, 20130100, http://www.phlix.net/, http://phlix.net/, http://phlix.net/, 3, 0, 0
1484, North America, United States, Phoenix, Phoenix-IX, Active, Ethernet, Association, 20120901, http://phoenix-ix.net, http://phoenix-ix.net/participants.html, , 44, 11000000, 0
946, North America, United States, Phoenix, TelX Internet Exchange, Active, Ethernet, Commercial, 20080602, http://tie.telx.com/, http://tie.telx.com/participants/, , 12, 2200000, 0
330, North America, United States, Pittsburgh, Three Rivers Optical Exchange, Active, , University, 20120529, http://ape.nzix.net/, , , 0, 0, 0
332, North America, United States, Portland, Northwest Access Exchange, Active, Ethernet, Association, 20021200, http://www.nwax.net, http://nwax.net, https://drive.google.com/file/d/0B-uO-5PpIbrbUXhabXEyX0Y5WWs/edit?usp=sharing, 77, 60000000, 163370
1878, North America, United States, Reno, Tahoe Internet Exchange , Active, Ethernet, Association, 20140912, http://www.tahoeix.org/, http://www.tahoeix.org/#connect, http://www.tahoeix.org/lg/, 12, 110000, 352
1723, North America, United States, Reston, Coresite - Any 2 NorthEast, Active, Ethernet, Commercial, 20130000, http://www.coresite.com/solutions/interconnection/Peering-Exchanges/ANY2, http://www.coresite.com/solutions/interconnection/Peering-Exchanges/ANY2/ANY2-Peering-Participants, , 30, 0, 0
589, North America, United States, Richardson, North Texas GigaPOP, Active, Ethernet, University, 20040820, http://www.northtexasgigapop.org/, http://www.northtexasgigapop.org/, , 7, 0, 0
1893, North America, United States, Richmond, Richmond Virginia Internet Exchange, Active, Ethernet, Association, 20150215, http://rva-ix.net, http://rva-ix.net/participants/, , 6, 0, 96
1872, North America, United States, Salt Lake City, Salt Lake Internet Exchange, Active, Ethernet, Association, 20140000, http://www.slix.net, http://www.slix.net, , 16, 0, 0
336, North America, United States, San Diego, San Diego Network Access Point, Active, Ethernet, University, 19980200, http://www.sdsc.edu/sdnap/, http://www.sdsc.edu/sdnap/title-members.htm, , 21, 0, 0
1841, North America, United States, San Francisco, AMS-IX Bay Area, Active, Ethernet, Association, 20140910, https://bay.ams-ix.net, https://bay.ams-ix.net/connected_parties, , 24, 10696700, 0
337, North America, United States, San Francisco, Equinix San Francisco, Active, , Commercial, 20010700, , , , 0, 0, 0
369, North America, United States, San Francisco, San Francisco Metropolitan Internet Exchange, Active, Ethernet, Association, 20060500, http://www.sfmix.org/, http://www.sfmix.org/participants, http://server.sfmix.org/cgi-bin/bgplg?cmd=show+ip+bgp+summary&req=, 52, 7040000, 119976
1724, North America, United States, San Jose, Coresite - Any 2 Northern California, Active, Ethernet, Commercial, 20130000, http://www.coresite.com/solutions/interconnection/Peering-Exchanges/ANY2, http://www.coresite.com/solutions/interconnection/Peering-Exchanges/ANY2/ANY2-Peering-Participants, , 50, 0, 0
339, North America, United States, San Jose, Equinix IBX San Jose, Active, Ethernet, Commercial, 20000525, http://www.equinix.net, , , 37, 0, 0
344, North America, United States, Seattle, Equinix-Seattle, Active, Ethernet, Commercial, 20000313, hhttp://www.equinix.com/locations/united-states-colocation/seattle-data-centers, x, , 0, 0, 97878
346, North America, United States, Seattle, Pacific Wave International Peering Exchange, Active, Ethernet, Commercial, 19960000, http://pacificwave.net, http://pacificwave.net/page_id=2/, , 0, 0, 0
345, North America, United States, Seattle, Seattle Internet Exchange, Active, Ethernet, Association, 19970620, http://www.seattleix.net/, http://www.seattleix.net/participants.htm, , 235, 505100000, 317927
347, North America, United States, Secaucus, Equinix IBX Secaucus, Active, Ethernet, Commercial, 20000314, http://www.equinix.net, , , 0, 0, 0
1874, North America, United States, St. George, Southern Utah Peering Regional Network, Active, Ethernet, Commercial, 0, www.suprnet.net, www.suprnet.net, , 11, 0, 0
357, North America, United States, Vienna, Equinix-VA, Active, Ethernet, Commercial, 20010910, http://www.equinix.com/, , , 0, 0, 0
253, North America, United States, Albuquerque, IXNM, Unknown, ATM,Ethernet,Frame Relay, Commercial, 20020200, http://www.ixnm.net, , , 18, 1372000, 0
254, North America, United States, Anchorage , Anchorage Metropolitan Access Point, Unknown, , , 0, , , , 0, 0, 0
257, North America, United States, Atlanta, Atlanta NAP, Unknown, , , 0, http://www.atlanta-nap.net/, , , 0, 0, 0
258, North America, United States, Atlanta, MAE-Central, Defunct, ATM, Unknown, 0, http://www.mae.net/fac/mae-central.htm, http://www.mae.net/fac/mae-central-members.htm, , 0, 0, 0
260, North America, United States, Austin, AUSIX, Defunct, Ethernet, , 0, , , , 0, 0, 0
261, North America, United States, Austin, Austin Metro Access Point, Defunct, Ethernet, , 0, http://www.fc.net/map/austin/, , , 0, 0, 0
262, North America, United States, Baltimore, Baltimore-NAP, Unknown, Ethernet, , 0, http://www.baltimore-nap.net/, , , 0, 0, 0
263, North America, United States, Bend, Central Oregon Exchange, Unknown, , , 0, , , , 0, 0, 0
657, North America, United States, Berkeley, 6TAP, Not an exchange, Layer-3, Unknown, 0, http://www.6tap.net/, http://www.6tap.net/6tap/6tap-participants.html, , 0, 0, 0
264, North America, United States, Berkeley, Calren2 North, Unknown, , , 0, , , , 0, 0, 0
265, North America, United States, Boston, Boston Metropolitan Exchange Point, Defunct, Ethernet, Unknown, 0, http://www.bmxp.net/, http://www.bmxp.net/members.html, , 18, 17740, 0
267, North America, United States, Chicago, Ameritech Advanced Data Services Network Access Point, Deprecated, , , 0, http://aads.net/index.html, , , 0, 0, 0
925, North America, United States, Chicago, Chicago Internet Exchange, Unknown, Ethernet, Association, 20080411, http://www.chicagoix.net, http://www.chicagoix.net/?page=members, , 11, 0, 137
269, North America, United States, Chicago, MAE-Chicago, Defunct, , , 0, , , , 0, 0, 0
270, North America, United States, Chicago, PacBell ATM Exchange, Defunct, ATM, , 0, , , , 0, 0, 0
273, North America, United States, Colchester, VermontIX, Defunct, Ethernet, , 0, http://www.hill.com/trc/vix/index.html, , , 0, 0, 0
274, North America, United States, Columbus, CMH-IX, Defunct, Ethernet, Unknown, 0, http://www.cmh-ix.net/, , , 0, 0, 0
275, North America, United States, Columbus, Columbus Internet Exchange, Unknown, , Unknown, 0, http://www.cmh-ix.net/, , , 0, 0, 0
276, North America, United States, Columbus, FiberNAP, Unknown, , , 0, http://www.fibernap.net/, , , 0, 0, 0
277, North America, United States, Dallas, Dallas/Fort Worth Metropolitan Access Point, Unknown, , , 0, http://www.fc.net/map/dfw/, , , 0, 0, 0
279, North America, United States, Dallas, Excel Telecom NAP, Unknown, , , 0, , , , 0, 0, 0
280, North America, United States, Dallas, MAE Central, Defunct, , Unknown, 0, , , , 0, 0, 0
281, North America, United States, Dallas, MAE-Dallas, Defunct, ATM, , 0, , , , 0, 0, 0
283, North America, United States, Denver, Denver Internet Exchange, Defunct, Ethernet, Commercial, 0, , , , 0, 0, 0
285, North America, United States, Denver, Equinix-Denver, Planned, Ethernet, Commercial, 0, , , , 0, 0, 0
1901, North America, United States, Denver, IX-Denver, Unknown, Ethernet, Association, 0, http://ix-denver.org, , , 0, 0, 0
284, North America, United States, Denver, Mountain Area Exchange, Defunct, Ethernet, Commercial, 0, http://themax.net/, , , 0, 0, 0
286, North America, United States, Eugene, Oregon Internet Exchange, Unknown, Ethernet, University, 0, http://darkwing.uoregon.edu/~oregonix/, , , 0, 0, 0
623, North America, United States, Helena, Northwest Internet Exchange, Unknown, Ethernet, Association, 20060200, http://www.nwix.org, http://www.nwix.org/members.html, , 3, 0, 0
289, North America, United States, Houston, Houston MAGIE, Unknown, , , 0, , , , 0, 0, 0
290, North America, United States, Houston, Houston Metropolitan Access Point, Unknown, Ethernet, , 0, http://www.fc.net/map/houston/, , , 0, 0, 0
291, North America, United States, Houston, MAE-Houston, Defunct, , , 0, , , , 0, 0, 0
655, North America, United States, Houston, TexasSEGP, Not an exchange, Layer-3, Unknown, 0, http://www.texassegp.org, http://www.texassegp.org/participants/index.php, , 0, 0, 0
293, North America, United States, Indianapolis, Indianapolis Data Exchange, Unknown, , , 0, http://www.indyx.net/info, , , 0, 0, 0
294, North America, United States, Los Angeles, 6IIX, Unknown, Ethernet, Commercial, 0, http://www.6iix.net/, , , 0, 0, 0
295, North America, United States, Los Angeles, Calren2 South, Unknown, , University, 0, , , , 0, 0, 0
296, North America, United States, Los Angeles, Equinix Los Angeles IBX, Unknown, Ethernet, Commercial, 0, , , , 0, 0, 0
300, North America, United States, Los Angeles, Equinix-LA(former Paix), Planned, Ethernet, Unknown, 0, , , , 0, 0, 0
298, North America, United States, Los Angeles, MAE-LA, Defunct, Ethernet, , 0, , , , 0, 0, 0
299, North America, United States, Los Angeles, Pac Bell Los Angeles Network Access Point, Defunct, ATM, , 0, , , , 0, 0, 0
301, North America, United States, Los Angeles, Pihana Los Angeles, Not an exchange, , , 0, , , , 0, 0, 0
302, North America, United States, Louisville, Louisville NAP, Unknown, , Unknown, 0, http://www.louisvillenap.net/, , , 0, 0, 0
304, North America, United States, Marina del Rey, ISI DMZ/Gigapop, Not an exchange, , , 0, , , , 0, 0, 0
1144, North America, United States, Medford, Southern Oregon Access Exchange, , Ethernet, Association, 0, http://www.soax.org/, http://www.soax.org/members, , 0, 0, 0
306, North America, United States, Miami, AMPATH - Florida International University/CIARA, Not an exchange, Ethernet, University, 20060000, http://www.ampath.net/, http://www.ampath.net/peering.php, , 4, 0, 0
305, North America, United States, Miami, BellSouth Multimedia Internet Exchange, Defunct, , , 0, , , , 0, 0, 0
309, North America, United States, Minneapolis, Northern Lights GigaPoP, Not an exchange, Layer-3, University, 20000000, http://www.northernlights.gigapop.net, http://www.northernlights.gigapop.net/participants.shtml, , 0, 0, 0
624, North America, United States, Missoula, Northwest Internet Exchange, Unknown, Ethernet, Association, 20041215, http://www.nwix.org, http://www.nwix.org/members.html, , 2, 0, 0
310, North America, United States, Moffett Field, AMES-MIX, Defunct, Ethernet, , 0, , , , 0, 0, 0
311, North America, United States, Moffett Field, MAE-West, Defunct, Ethernet, Unknown, 0, http://www.mae.net/fac/, , , 0, 0, 0
312, North America, United States, Moffett Field, NGIX-West, Unknown, , Unknown, 19980000, , , , 0, 0, 0
1907, North America, United States, Montgomery, Montgomery Internet Exchange, Unknown, , Municipal, 0, www.mix-al.net, , , 0, 0, 0
313, North America, United States, Nashville, Nashville City Net, Unknown, Ethernet, , 0, http://www.nap.nashville.tn.us/, , , 0, 0, 0
314, North America, United States, Nashville, Nashville NAP, Unknown, , , 0, , , , 0, 0, 0
316, North America, United States, New York, 6IIX, Unknown, Ethernet, , 0, http://www.6iix.net/, , , 0, 0, 0
318, North America, United States, New York, MAE-NY, Defunct, , Commercial, 0, , , , 0, 0, 0
319, North America, United States, New York, MetroIX, Unknown, Ethernet, , 0, http://www.metroix.net/, , , 0, 0, 0
885, North America, United States, New York, New York City Exchange, , Ethernet, Unknown, 0, , , , 0, 0, 0
322, North America, United States, New York, NY-RIX, Unknown, Ethernet, , 0, , , , 0, 0, 0
324, North America, United States, Ohio, OhioEP, Unknown, , , 0, , , , 0, 0, 0
326, North America, United States, Pennsauken, Sprint NAP, Defunct, , , 0, http://www.merit.edu/nsf.architecture/Sprint/index.html, , , 0, 0, 0
327, North America, United States, Philadelphia, Equinix-Philly(former Paix), Planned, Ethernet, Unknown, 0, , , , 0, 0, 0
1846, North America, United States, Philadelphia, Philadelphia Internet Exchange, Unknown, Ethernet, Association, 0, http://phlix.net, , , 0, 0, 0
1288, North America, United States, Phoenix, Arizona Internet Exchange, Defunct, Ethernet, Association, 20110000, http://arizonaix.net/, http://arizonaix.net/peers.pl, , 7, 118000, 0
625, North America, United States, Phoenix, Phoenix Internet Exchange, Unknown, Ethernet, Association, 0, http://www.phx-ix.net, , , 0, 0, 0
329, North America, United States, Phoenix, PhoenixNAP, Defunct, , Unknown, 0, http://www.phoenixnap.net, , , 0, 0, 0
331, North America, United States, Pittsburgh, Pittsburgh Exchange Point, Unknown, Ethernet, Commercial, 0, http://www.pitx.net/, http://www.pitx.net/members.html, , 7, 7200, 0
597, North America, United States, Portland, MaineXchangePoint, Unknown, Layer-3, Association, 0, http://www.mainexp.net, , , 0, 0, 0
1927, North America, United States, Portland, Northern New England Neutral Internet Exchange, Planned, Ethernet, Association, 0, http://www.nnenix.net, http://www.nnenix.net/participants/, , 0, 0, 0
333, North America, United States, Salt Lake City, Utah Regional Exchange Point, Unknown, , Unknown, 19960423, http://www.utah.rep.net/, http://www.utah.rep.net/people.html, , 13, 9000, 0
334, North America, United States, San Antonio, San Antonio Metro Access Point, Unknown, , , 0, http://www.fc.net/map/samap/, , , 0, 0, 0
335, North America, United States, San Diego, Equinix-SD(former Paix), Planned, Ethernet, Unknown, 0, , , , 0, 0, 0
338, North America, United States, San Francisco, PB-NAP, Defunct, ATM, Commercial, 0, , , , 0, 0, 0
898, North America, United States, San Jose, KDWEB Exchange, Not an exchange, Ethernet, Unknown, 0, http://www.kd-web.net/, , , 0, 0, 0
340, North America, United States, San Jose, MAE-West-ATM, Defunct, ATM, Commercial, 0, , , , 0, 0, 0
341, North America, United States, Santa Clara, 6IIX, Defunct, Ethernet, Unknown, 20010000, http://www.6iix.net/, , , 0, 0, 0
342, North America, United States, Seattle, NIX, Defunct, Frame Relay, , 0, , , , 0, 0, 0
343, North America, United States, Seattle, NWnet Gigapop, Unknown, , , 0, , , , 0, 0, 0
348, North America, United States, Spokane, Eastern Washington Internet Exchange, Unknown, Ethernet, , 0, http://www.dsource.com/ewix/, , , 0, 0, 0
349, North America, United States, St. Louis, St. Louis Internet Access Consortium, Unknown, , , 0, , , , 0, 0, 0
350, North America, United States, St. Louis, St. Louis Regional Exchange Point, Defunct, Ethernet, Association, 20060221, http://www.stlrepcollaborative.org, http://www.stlrepcollaborative.org/members.html, , 20, 0, 0
351, North America, United States, St. Louis, StLouisNAP, Defunct, Ethernet, , 0, , , , 0, 0, 0
