96, Asia-Pacific, China, Hong Kong, Hong Kong Internet Exchange, Active, Ethernet, University, 19950400, http://www.hkix.net, http://www.hkix.net/hkix/participant.htm, http://www.hkix.net/hkix/hkixlg.htm, 234, 654643000, 394683
971, Asia-Pacific, China, Beijing, CNC Beijing NAP, Unknown, Ethernet, Unknown, 20080000, , , , 0, 0, 0
44, Asia-Pacific, China, Beijing, TerreNAP Beijing, Unknown, , , 0, http://www.corporate-ir.net/ireye/ir_site.zhtml?ticker=tww&script=410&layout=-6&item_id=137869, , , 0, 0, 0
45, Asia-Pacific, China, Guangzhou, , Unknown, , , 20001200, , , , 0, 0, 0
95, Asia-Pacific, China, Hong Kong, Hong Kong Academic Internet Exchange, Planned, Ethernet, , 0, http://cn.apan.net?, , , 0, 0, 0
97, Asia-Pacific, China, Hong Kong, Level3, Defunct, Ethernet, , 0, , , , 0, 0, 0
98, Asia-Pacific, China, Hong Kong, Pihana Hong Kong, Not an exchange, , , 0, , , , 0, 0, 0
46, Asia-Pacific, China, Shanghai, Asia Pacific Internet Exchange, Not an exchange, Layer-3, , 0, , , , 0, 0, 0
47, Asia-Pacific, China, Shanghai, Shanghai City Exchange, Unknown, , , 0, , , , 0, 0, 0
48, Asia-Pacific, China, Shanghai, Shanghai Internet Exchange, Unknown, , , 20001200, http://www.sii.com.cn/html/en/infoport/internet_exchange_center.htm, , , 8, 0, 0
49, Latin America, Colombia, Bogotá, NAP-Colombia, Active, , Association, 20000629, http://www.nap.com.co/, http://www.nap.com.co/html/integrantes.php, , 19, 45500000, 0
50, Latin America, Colombia, , CIN, Unknown, , , 0, , , , 0, 0, 0
985, Latin America, Colombia, Bogota, NAP de las Americas Colombia, Unknown, Ethernet, Commercial, 20080300, http://www.verizonenterprise.com/infrastructure/data-centers/latin-america/nap-de-las-americas-colombia/, , , 14, 0, 0
1541, Africa, Congo-Brazzaville, Brazzaville, Congo Brazzaville IX, Active, Ethernet, Governmental, 20130510, http://www.cgix-congo.cg/, http://www.cgix-congo.cg/membre.html, , 7, 20, 0
1574, Africa, Congo-Brazzaville, Pointe-Noire, CG-IX Pointe-Noire, , Ethernet, Association, 0, , , , 0, 0, 0
479, Africa, Congo-Kinshasa, Kinshasa, Kinshasa Internet Exchange, Active, Ethernet, Association, 20021100, http://www.ispa-drc.cd/, http://www.ispa-drc.cd/index.php?option=com_content&view=article&id=2&Itemid=4, , 9, 617670, 0
1910, Africa, Congo-Kinshasa, Goma, Goma Internet Exchange, Planned, Ethernet, Association, 0, http://www.ispa-drc.cd/index.php?option=com_content&view=article&id=20&Itemid=20, , , 0, 0, 0
1909, Africa, Congo-Kinshasa, Lubumbashi, Lubumbashi Internet Exchange, Planned, Ethernet, Association, 0, http://www.ispa-drc.cd/index.php?option=com_content&view=article&id=21&Itemid=21, , , 0, 0, 0
1806, Latin America, Costa Rica, San Jose, Punto de Intercambio Neutro de Internet, Active, Ethernet, Association, 20140429, http://www.crix.cr/, https://www.crix.cr/miembros, , 21, 272660, 1317
1801, Africa, Cote D'Ivoire, Abidjan, Côte d'Ivoire Internet Exchange Point, Active, Ethernet, Governmental, 20131003, www.civix.ci, http://www.civix.ci/index.php/membres, , 6, 79000, 0
699, Africa, Cote D'Ivoire, Abidjan, Côte d'Ivoire Internet Exchange Point, Defunct, Ethernet, Unknown, 20060000, http://www.ciixp.ci, , , 5, 4000, 0
51, Europe, Croatia, Zagreb, Croatian Internet Exchange, Active, , University, 20050000, http://www.cix.hr/, http://www.cix.hr/cix_clanice.html, http://www.cix.hr/index.php?id=lg&L=1, 29, 64000000, 0
52, Latin America, Cuba, Habana, NAP de Cuba, Active, Ethernet, Governmental, 20010600, http://www.etecsa.cu/?page=internet_conectividad&sub=transmision_datos, , , 5, 50000, 0
988, Latin America, Curaçao, Willemstad, Caribbean Internet Exchange, Active, Ethernet, Association, 20090420, https://cw.ams-ix.net/, https://cw.ams-ix.net/connected_parties, , 13, 9394000, 0
53, Europe, Cyprus, Lefkosia, Cyprus Internet Exchange, Active, Ethernet, University, 19990000, http://www.cytanet.com.cy/network/cyix/, , , 3, 10000, 0
613, Europe, Czech Republic, Prague, Neutral czFree eXchange, Active, Ethernet, Association, 20070000, http://www.nfx.cz, http://www.nfx.cz/clenove, , 19, 42400000, 0
55, Europe, Czech Republic, Prague, NIX.CZ - Neutral Internet eXchange for the Czech Republic, Active, Ethernet, Association, 19960831, http://www.nix.cz, https://www.nix.cz/en/networks, , 141, 446000000, 0
1758, Europe, Czech Republic, Prague, Peering.cz, Active, Ethernet, Commercial, 20121017, http://www.peering.cz, http://peering.cz/en/traffic, http://lg.peering.cz, 91, 265000000, 101876
612, Europe, Czech Republic, Brno, Commercial Brno Internet Exchange, Defunct, Ethernet, Commercial, 20070512, http://www.cbix.cz/en, http://www.cbix.cz/en/connected-networks, , 7, 0, 0
54, Europe, Czech Republic, Brno, Neutral Internet Exchange, Planned, , , 0, , , , 0, 0, 0
1853, Europe, Denmark, Copenhagen, Content-IX, Active, Ethernet, Commercial, 20120200, www.content-ix.dk, http://www.globalconnect.dk/produkter/internet/ip-transit/content-ix-medlemsliste, , 10, 0, 0
56, Europe, Denmark, Copenhagen, Danish Internet Exchange, Active, Ethernet, University, 19940500, http://www.dix.dk/, http://www.dix.dk/connectednetworks/, , 45, 43200000, 0
1781, Europe, Denmark, Copenhagen, Netnod COMIX, Active, Ethernet, Association, 20140500, www.netnod.se, http://www.netnod.se/ix/members, , 40, 54339000, 0
1261, Europe, Denmark, Copenhagen, Copenhagen Internet Exchange, Defunct, Ethernet, Unknown, 0, http://www.cophix.net/, http://www.cophix.net/members, , 29, 0, 0
1364, Latin America, Dominica, Roseau, Dominica National Internet Exchange Point, Active, Ethernet, Governmental, 20130227, http://danix.dm/, , , 6, 67470, 34
984, Latin America, Dominican Republic, Santo Domingo, NAP del Caribe, Active, Ethernet, Commercial, 20080700, http://www.rsandh.com/who-we-serve/corporate/mission-critical/data-centers/terremark-nap-del-caribe, , , 0, 0, 0
57, Latin America, Ecuador, Guayaquil, NAP AEPROVI Guayaquil, Active, Ethernet, Association, 20030000, http://www.aeprovi.org.ec/index.php?option=com_content&task=blogcategory&id=5&Itemid=85, , , 34, 2802555, 0
58, Latin America, Ecuador, Quito, NAP AEPROVI Quito, Active, Ethernet, Association, 20030000, http://www.aeprovi.org.ec/index.php?option=com_content&task=blogcategory&id=5&Itemid=85, http://www.aeprovi.org.ec/index.php?option=com_content&task=view&id=30&Itemid=26, , 28, 16631447, 0
59, Africa, Egypt, Cairo, Cairo Internet Exchange, Active, Ethernet, Governmental, 20020500, http://www.caix.net.eg/, http://www.caix.net.eg/index.php/member-list, , 7, 1390000, 3268
593, Africa, Egypt, Cairo, Middle East Internet eXchange, Active, Ethernet, Commercial, 20070500, http://www.gpxglobal.net/, , , 10, 27, 0
60, Africa, Egypt, Cairo, Cairo Regional Internet Exchange, Defunct, Ethernet, , 20020500, http://www.cr-ix.net, , , 3, 0, 0
621, Latin America, El Salvador, San Salvador, IXP de El Salvador, Planned, Ethernet, Association, 0, , , , 0, 0, 0
1365, Europe, Estonia, Tallinn, Tallinn Governmental Internet Exchange, Active, Ethernet, Governmental, 20090700, http://www.rtix.ee/rtix/, , , 7, 0, 1109
68, Europe, Estonia, Tallinn, Tallinn Internet Exchange (TIX), Active, Ethernet, Commercial, 20020000, http://tix.estpak.ee, http://tix.estpak.ee/?members, , 13, 425250, 0
559, Europe, Estonia, Tallinn, Tallinn Internet Exchange (TLLIX), Active, Ethernet, Commercial, 20051100, http://www.tllix.net, http://www.tllix.net/index.php?2,34, , 17, 1300000, 0
1516, Europe, Finland, Espoo, Finnish Communication and Internet Exchange Espoo, Active, Ethernet, Association, 19930000, http://www.ficix.fi/english/main.php, http://www.ficix.fi/english/member.php, , 23, 19100000, 0
69, Europe, Finland, Helsinki, Finnish Communication and Internet Exchange Helsinki, Active, Ethernet, Association, 19930000, http://www.ficix.fi/english/main.php, http://www.ficix.fi/english/member.php, , 25, 36000000, 0
1515, Europe, Finland, Oulu, Finnish Communication and Internet Exchange Oulu, Active, Ethernet, Association, 20080000, http://www.ficix.fi/english/main.php, https://www.ficix.fi/membership/ficix-jasenet/, , 29, 900000, 0
70, Europe, Finland, Tampere, Tampere Region Exchange, Active, Ethernet, University, 20030803, http://www.trex.fi/, http://www.trex.fi/members.html, , 15, 6000000, 1217
712, Europe, France, Alsace, EuroGIX, Active, Ethernet, Association, 20020304, http://www.eurogix.net/, http://www.eurogix.net/fr/membres-eurogix, , 6, 1570, 0
1792, Europe, France, Cayenne, Guyanix, Active, Ethernet, University, 20131001, http://www.renater.fr/guyanix, , , 0, 0, 0
1373, Europe, France, Grenoble, GrenoblIX, Active, , Association, 20130000, http://www.grenoblix.net/, http://communication.rezopole.net/participants.php?ix=grenoblix, , 7, 0, 0
1854, Europe, France, Lille, Lillix, Active, Ethernet, Association, 20140627, http://www.lillix.fr, http://www.lillix.fr/membres/, , 12, 0, 0
71, Europe, France, Lyon, Lyon Internet Exchange, Active, Ethernet,Layer-3, Association, 20100601, http://www.lyonix.net/, http://www.lyonix.net/en/members-area/lyonix-members-list, https://noc.rezopole.net/lg/, 93, 25408732, 31926
1894, Europe, France, Marseille, DE-CIX Marseille, Active, Ethernet, Commercial, 0, https://www.de-cix.net/products-services/de-cix-marseille/, , , 0, 400000, 0
1656, Europe, France, Marseille, France-IX Marseille, Active, Ethernet, Association, 20110000, https://www.franceix.net/, https://www.franceix.net/en/members-resellers/members/, https://tools.franceix.net/lg, 299, 50760000, 0
504, Europe, France, Marseille, Marseille Internet Exchange, Active, Ethernet, Association, 20050000, http://www.ma-ix.net/, http://www.ma-ix.net/members.php, , 0, 0, 0
1815, Europe, France, Nantes, Ouest IX, Active, Ethernet, Association, 20140402, http://www.ouestix.fr, , , 10, 0, 0
1837, Europe, France, Nice, NicIX - Alpes-Maritimes, Active, Ethernet, Association, 20140619, http://www.nicix.net/en, , , 3, 88000, 0
1097, Europe, France, Paris, Equinix Paris, Active, Ethernet, Commercial, 20080000, http://www.equinix-ix.fr, http://www.equinix-ix.fr/members.php, , 315, 0, 146678
1658, Europe, France, Paris, FR-IX 75, Active, Ethernet, Association, 20100505, http://www.fr-ix.fr/, https://mon.nap75.fr-ix.fr/p-liste.php, https://mon.nap75.fr-ix.fr/p-lg.php, 13, 0, 0
1124, Europe, France, Paris, France-IX, Active, Ethernet, Association, 20101100, http://www.france-ix.fr/, https://www.franceix.net/en/members-resellers/members/, https://tools.franceix.net/lg, 299, 1065420000, 207270
629, Europe, France, Paris, French National Internet Exchange IPv6, Active, Ethernet, Commercial, 20021101, http://www.fnix6.net, http://www.fnix6.net/members/, , 16, 0, 0
74, Europe, France, Paris, Mix Internet Exchange and Transit, Active, , Commercial, 19990000, http://www.mixt.net/, http://www.mixt.net/membres?PHPSESSID=d70789dd2193dfc12c377b1c95fbe580, , 7, 0, 0
78, Europe, France, Paris, Service for French Internet Exchange, Active, Ethernet, Association, 19950000, https://www.sfinx.fr/, https://www.sfinx.fr/, , 95, 26200000, 14164
1790, Europe, France, Saint-Denis, Réunion, Réunion Internet Exchange, Active, Ethernet, University, 20060200, http://www.renater.fr/reunix?lang=en, http://www.renater.fr/connected-members,579, , 10, 0, 0
1230, Europe, France, Toulouse, Le GIX de la grande region Toulousaine, Active, Ethernet, Association, 20090416, http://www.touix.net/, http://www.touix.net/node/6, , 11, 0, 0
1923, Europe, France, Mamoudzou, Mayotte, Mayotte Internet Exchange, Unknown, Ethernet, University, 0, https://www.renater.fr/mayotix?lang=en, , , 0, 0, 0
72, Europe, France, Paris, Free-IX, Defunct, Ethernet, Association, 20000000, http://www.FreeIX.net, http://tools.freeix.net/freeix/cgi-bin/members.pl, , 106, 2890000, 0
838, Europe, France, Paris, Gigabit European Internet eXchange, Defunct, Ethernet, Unknown, 0, http://ether.geix.net, http://ether.geix.net, , 8, 0, 0
1877, Europe, France, Paris, Hopus, Not an exchange, Ethernet, Commercial, 20140100, http://hopus.net, http://hopus.net, http://hopus.net/members, 25, 155000000, 0
73, Europe, France, Paris, Metropolitan Area Ethernet-Paris, Unknown, Ethernet, Commercial, 0, http://www.mae.net/fac/mae-paris.htm, http://www.mae.net/fac/mae-paris-members.htm, , 18, 0, 0
75, Europe, France, Paris, Paris Internet Exchange, Deprecated, , , 0, , , , 0, 0, 0
76, Europe, France, Paris, Paris Internet Exchange Service, Unknown, , Unknown, 0, , , , 0, 0, 0
79, Europe, France, Paris, Paris NAP, Defunct, Ethernet, Unknown, 20050700, http://www.panap.fr, http://www.panap.fr/members.php, , 153, 848000, 0
628, Europe, France, Paris, Paris Operators for Universal Internet eXchange, Defunct, Ethernet, Association, 0, http://www.pouix.net/, http://www.pouix.net/members-en, , 33, 0, 0
77, Europe, France, Paris, PARIX, Not an exchange, Ethernet, Commercial, 20010000, http://www.parix.net, http://www.parix.net/parix-members.html, , 46, 14000000, 0
1231, Europe, France, Saint Etienne, The Saint-Etienne Internet eXchange Point, Defunct, Ethernet, Association, 20110100, http://www.saintetix.net/, http://www.saintetix.net/en/members-area, , 2, 0, 0
973, Europe, France, Saint-Etienne, PhibIX Gix & Nap, Defunct, Ethernet, Unknown, 20080000, http://www.phibix.net, , , 2, 0, 0
1375, Europe, France, Valence, The Ardèche and Drôme Internet eXchange Point , Defunct, Ethernet, Association, 20120000, http://www.adn-ix.net/en/, http://www.adn-ix.net/en/adnix-members, https://noc.rezopole.net/lg/, 2, 0, 0
1887, Africa, Gabon, Libreville, Gabon Internet Exchange, Active, Ethernet, Association, 0, http://www.gabix.ga, , , 4, 0, 0
1811, Africa, Gambia, Serrekunda, Serrekunda Internet Exchange Point, Active, Ethernet, Association, 20130725, www.sixp.gm, http://www.sixp.gm/about.html, http://www.sixp.gm/services.html#Looking_Glass, 14, 560000, 111
80, Europe, Germany, Berlin, Berlin Commercial Internet Exchange, Active, Ethernet, Association, 20020906, http://www.bcix.de/, http://www.bcix.de/bcix/members/, , 80, 130000000, 189403
81, Europe, Germany, Berlin, European Commercial Internet Exchange Berlin, Active, Ethernet, Commercial, 20030000, http://www.ecix.net/, http://www.ecix.net/about-us/members/, , 155, 286000000, 136905
1855, Europe, Germany, Bremen, BREM-IX, Active, Ethernet, Commercial, 20130000, http://www.brem-ix.net, , , 10, 950000, 0
1856, Europe, Germany, Dortmund, Dortmund Internet exchange, Active, Ethernet, Association, 20130901, https://www.do-ix.net, https://www.do-ix.net/members, , 8, 0, 0
1919, Europe, Germany, Dusseldorf, DE-CIX Dusseldorf, Active, , Commercial, 20160000, https://www.de-cix.net/products-services/de-cix-dusseldorf/, https://www.de-cix.net/customers-partners/customers/de-cix-dusseldorf/, , 3, 0, 0
82, Europe, Germany, Düsseldorf, European Commercial Internet Exchange Düsseldorf, Active, Ethernet, Commercial, 20030000, http://www.ecix.net/, http://www.ecix.net/about-us/members/, , 97, 22930000, 148088
1667, Europe, Germany, Düsseldorf, OpenCarrier e.G. Member IX Duesseldorf, Active, Ethernet, Association, 20070500, http://www.opencarrier.eu/, http://www.opencarrier.eu/2-mitglieder.html, , 30, 0, 0
83, Europe, Germany, Frankfurt, Deutscher Commercial Internet Exchange, Active, Ethernet, Association, 19950500, https://www.de-cix.net/, https://www.de-cix.net/customers-partners/customers/de-cix-frankfurt/, http://lg.de-cix.net/, 702, 4791800200, 1084234
1663, Europe, Germany, Frankfurt, European Commercial Internet Exchange, Active, Ethernet, Commercial, 20130408, http://www.ecix.net/, http://www.ecix.net/about-us/members/, , 155, 0, 159237
717, Europe, Germany, Frankfurt, Frankfurt Network Access Point, Active, , Association, 20031001, http://www.franap.net/, , , 10, 0, 0
556, Europe, Germany, Frankfurt, KleyReX Internet Exchange, Active, Ethernet, Commercial, 20020900, http://www.kleyrex.net/, http://www.kleyrex.net/teilnehmer.php, , 138, 3060000, 0
1670, Europe, Germany, Frankfurt, OpenCarrier e.G. Member IX Frankfort, Active, Ethernet, Association, 20070500, http://www.opencarrier.eu/, http://www.opencarrier.eu/2-mitglieder.html, , 30, 0, 0
88, Europe, Germany, Hamburg, DE-CIX Hamburg, Active, Ethernet, Association, 20080000, http://www.de-cix.net/products-services/de-cix-hamburg/, http://www.de-cix.net/customers-partners/customers/de-cix-hamburg/, , 38, 23900000, 0
1052, Europe, Germany, Hamburg, European Commercial Internet Exchange Hamburg, Active, Ethernet, Commercial, 20090121, http://www.ecix.de, https://www.ecix.net/about-us/members/, , 38, 0, 137111
86, Europe, Germany, Hamburg, Internet Exchange Hamburg, Active, Ethernet, Commercial, 20001000, http://www.inxs.de, http://www.inxs.de/public/cgi-bin/showmembers, https://support.cw.com/prod/tools_lookingglass.html?CW=68b5b2fbf2bd809834bceba6d6519385, 40, 21000000, 0
87, Europe, Germany, Hamburg, XchangePoint Hamburg IPP, Active, Ethernet, Unknown, 20030400, http://www.xchangepoint.net, , , 2, 0, 0
1271, Europe, Germany, Munich, DE-CIX Munich, Active, Ethernet, Association, 20100400, http://www.de-cix.net/products-services/de-cix-munich/, http://www.de-cix.net/customers-partners/customers/de-cix-munich/, , 27, 12300000, 0
89, Europe, Germany, Munich, Internet Exchange Service, Active, Ethernet, Commercial, 19940600, http://www.inxs.de, http://www.inxs.de/public/cgi-bin/showmembers, , 40, 21000000, 47901
92, Europe, Germany, Nuremberg, Nürnberger Internet Exchange, Active, Ethernet, Association, 20030000, http://www.n-ix.de, http://www.n-ix.net/teilnehmerliste.html?&L=2, http://www.n-ix.net/lg.html, 43, 5700000, 8942
705, Europe, Germany, Stuttgart, Stuttgarter Internet Exchange, Active, Ethernet, Association, 20050400, http://www.s-ix.info/, http://www.s-ix.info/Teilnehmer.htm, http://six.interscholz.net/, 22, 2591956, 0
1914, Europe, Germany, Wuppertal, United Peering, Active, Ethernet, Commercial, 20150910, https://united-peering.net, , , 13, 0, 0
718, Europe, Germany, Darmstadt, Metropolitan Area Network Darmstadt, Unknown, , Unknown, 0, http://www.tu-darmstadt.de/hrz/manda/, , , 0, 0, 0
84, Europe, Germany, Frankfurt, MAE-Frankfurt, Unknown, ATM, Unknown, 0, http://www.mae.net/fac/mae-frankfurt.htm, http://www.mae.net/fac/mae-frankfurt-members.htm, , 0, 0, 0
85, Europe, Germany, Frankfurt, XchangePoint Frankfurt IPP, Unknown, , , 0, , , , 9, 10000, 0
716, Europe, Germany, Hamburg, Hansestadt Hamburg Commercial Internet Exchange, Defunct, , Unknown, 20030117, http://www.hhcix.de/, , , 13, 0, 0
881, Europe, Germany, Leipzig, European Commercial Internet Exchange Leipzig, Planned, Ethernet, Commercial, 0, http://www.lei.ecix.de/index.shtml, http://www.lei.ecix.de/members.shtml, , 0, 0, 0
90, Europe, Germany, Munich, Munich Commercial Internet Exchange, Defunct, , , 0, , , , 0, 0, 0
91, Europe, Germany, Münster, Nederlands-Duitse Internet Exchange, Planned, Ethernet, , 0, http://www.ndix.net, , , 0, 0, 0
93, Africa, Ghana, Accra, Ghana Internet Exchange, Active, Ethernet, Association, 20051018, http://www.gixa.org.gh, http://www.gixa.org.gh/?page_id=12, , 17, 440000, 0
94, Europe, Greece, Athens, Greek Internet Exchange, Active, Ethernet, Association, 20000000, http://www.gr-ix.gr/, http://www.gr-ix.gr/members/, , 25, 40000000, 0
1297, Latin America, Grenada, St. Georges, Grenada Internet Exchange, Active, Ethernet, Association, 20110512, http://ixgd.wordpress.com, http://ixgd.wordpress.com/membership/, , 6, 3000, 90
982, Latin America, Haiti, Port au Prince, AHTIC Internet Exchange Point, Active, Ethernet, Association, 20090505, http://ixp.ht/, , , 9, 2116947, 48
1903, Latin America, Honduras, Tegucigalpa, IXP-HN Puntos de Intercambio de Tráfico  Honduras, Active, , Governmental, 0, http://www.ixp.hn, http://www.ixp.hn/?p=20, , 0, 0, 18
99, Europe, Hungary, Budapest, Budapest Internet Exchange, Active, Ethernet, Association, 19960000, http://www.bix.hu/, http://www.bix.hu/?lang=en&page=members, http://www.bix.hu/lg/lg.cgi, 52, 181400000, 0
100, Europe, Iceland, Reykjavik, Reykjavik Internet Exchange, Active, , Association, 19990000, http://www.rix.is, http://www.rix.is/connected.html, , 24, 11502252, 0
1022, Asia-Pacific, India, Ahmedabad, National Internet Exchange of India, Active, Ethernet, Association, 20080000, http://nixi.in/index.php?option=com_noclocation&task=click&id=58&Itemid=28, http://nixi.in/index.php?option=com_noclocation&task=click&id=58&Itemid=28, http://www.nixi.in/lookingglass.php, 3, 8000, 0
1020, Asia-Pacific, India, Bangalore, National Internet Exchange of India, Active, Ethernet, Association, 20080000, http://nixi.in/index.php?option=com_noclocation&task=click&id=60&Itemid=28, http://nixi.in/index.php?option=com_noclocation&task=click&id=60&Itemid=28, http://www.nixi.in/lookingglass.php, 8, 3600, 0
105, Asia-Pacific, India, Chennai, National Internet Exchange of India, Active, Ethernet, Governmental, 20030719, http://nixi.in/en/noc-locations/55?view=noclocation, http://nixi.in/en/member-list, http://www.nixi.in/lookingglass.php, 41, 3545906, 0
1021, Asia-Pacific, India, Hyderabad, National Internet Exchange of India, Active, Ethernet, Association, 20080000, http://nixi.in/index.php?option=com_noclocation&task=click&id=59&Itemid=28, http://nixi.in/index.php?option=com_noclocation&task=click&id=59&Itemid=28, http://www.nixi.in/lookingglass.php, 6, 2097, 0
106, Asia-Pacific, India, Kolkata, National Internet Exchange of India, Active, Ethernet, Association, 20030719, http://nixi.in/index.php?option=com_noclocation&task=click&id=53&Itemid=28, http://nixi.in/index.php?option=com_noclocation&task=click&id=53&Itemid=28, http://www.nixi.in/lookingglass.php, 10, 7556, 0
1842, Asia-Pacific, India, Mumbai, Mumbai Convergence Hub, Active, Ethernet, Association, 20140815, www.mumbaich.com, https://mumbaich.com/connectednetworks, www.mumbaich.com/lg, 53, 0, 4002
103, Asia-Pacific, India, Mumbai, National Internet Exchange of India, Active, Ethernet, Association, 20030719, http://nixi.in/en/, http://nixi.in/en/member-list, http://www.nixi.in/lookingglass.php, 50, 5368709, 0
104, Asia-Pacific, India, New Delhi, National Internet Exchange of India, Active, Ethernet, Association, 20030719, http://nixi.in/index.php?option=com_noclocation&task=click&id=52&Itemid=28, http://nixi.in/index.php?option=com_noclocation&task=click&id=52&Itemid=28, http://www.nixi.in/lookingglass.php, 24, 1176081, 0
1024, Asia-Pacific, India, Lucknow, National Internet Exchange of India, Planned, Ethernet, Association, 0, http://nixi.in/index.php?option=com_noclocation&task=click&id=57&Itemid=28, http://nixi.in/index.php?option=com_noclocation&task=click&id=57&Itemid=28, , 0, 0, 0
1023, Asia-Pacific, India, Mohali, National Internet Exchange of India, Planned, Ethernet, Association, 0, http://nixi.in/index.php?option=com_noclocation&task=click&id=56&Itemid=28, http://nixi.in/index.php?option=com_noclocation&task=click&id=56&Itemid=28, , 0, 0, 0
101, Asia-Pacific, India, Mumbai, Enron India Exchange, Defunct, , , 0, , , , 0, 0, 0
102, Asia-Pacific, India, New Delhi, India Internet Exchange, Unknown, , Unknown, 0, http://www.in-ix.net/, , , 0, 0, 0
907, Asia-Pacific, Indonesia, Jakarta, Biznet Internet Exchange, Active, Ethernet, Commercial, 20060000, http://www.biznetnetworks.com/En/?menu=Bix, http://www.biznetnetworks.com/En/?menu=Bix, , 18, 3000000, 0
110, Asia-Pacific, Indonesia, Jakarta, Indonesian Internet Exchange, Active, Layer-3, Association, 19970800, http://www.iix.net.id, , http://www.iix.net.id/?do=lg, 99, 3400000, 31888
1263, Asia-Pacific, Indonesia, Jakarta, Matrix Cable System Internet Exchange, Active, Ethernet, Commercial, 20110000, http://www.nap.net.id/internet_exchange.html, , , 70, 10000000, 124121
1546, Asia-Pacific, Indonesia, Jakarta, NEX Internet Exchange, Active, Ethernet, Commercial, 20100000, http://www.nexdatacenter.com, , , 22, 990000, 0
1550, Asia-Pacific, Indonesia, Jakarta, OpenIXP Internet exchange Point, Active, Ethernet, Commercial, 20050000, http://www.openixp.net/, , http://lg.mohonmaaf.com/index.cgi, 673, 241000000, 19
1549, Asia-Pacific, Indonesia, Surabaya, IIX Jawa Timur, Active, Ethernet, Association, 20080000, http://www2.jatim.apjii.or.id/, , , 11, 0, 0
114, Asia-Pacific, Indonesia, Surabaya, Indonesian Internet Exchange, Active, , Association, 20031000, http://www.iix.net.id, , http://www.iix.net.id/?do=lg, 0, 0, 0
113, Asia-Pacific, Indonesia, , , Defunct, , Unknown, 20040300, http://www.iix.net.id, , , 0, 0, 0
107, Asia-Pacific, Indonesia, Bali, Bali Internet Exchange, Planned, , , 0, , , , 0, 0, 0
108, Asia-Pacific, Indonesia, Bandung, NPXP, Planned, , , 0, , , , 0, 0, 0
1548, Asia-Pacific, Indonesia, DKI Jakarta, PT. Cyberplus Media Pratama, Planned, , Unknown, 20130000, http://www.cyberplus.net.id/, , , 0, 0, 0
109, Asia-Pacific, Indonesia, Jakarta, IndonesiaEP, Unknown, , , 0, , , , 0, 0, 0
111, Asia-Pacific, Indonesia, Jakarta, Jakarta Internet Exchange, Planned, , , 0, , , , 0, 0, 0
112, Asia-Pacific, Indonesia, Jakarta, NAPSINDO International Internet Exchange, Defunct, , Unknown, 0, http://www.naiix.net/, , , 0, 0, 0
972, Asia-Pacific, Indonesia, Jakarta, PT. Cyberindo Aditama, Unknown, Ethernet, Unknown, 20080000, http://www.cbn.net.id, , , 0, 0, 0
115, Asia-Pacific, Indonesia, Surabaya, NPXP, Planned, , , 0, , , , 0, 0, 0
1902, Europe, Iran, Tehran, Tehran IX, Active, Ethernet, Governmental, 20160515, http://www.tehran-ix.ir, http://www.tehran-ix.ir/members, , 24, 9530000, 0
1105, Europe, Ireland, Cork, Cork Neutral Internet Exchange, Active, Ethernet, Association, 20090717, http://www.cnix.ie, http://www.cnix.ie/members.html, , 14, 0, 0
116, Europe, Ireland, Dublin, Internet Neutral Exchange Association Limited, Active, Ethernet, Association, 19960000, http://www.inex.ie, https://www.inex.ie/about/memberlist, , 106, 110000000, 159677
1108, Europe, Ireland, Galway, eXchange West, Active, Ethernet, Association, 20090604, http://www.exwest.net, http://www.exwest.net, , 5, 0, 0
