117, Europe, Israel, Tel Aviv, Israeli Internet Exchange, Active, Layer-3, Association, 19960000, http://www.isoc.org.il/iix/index.html, http://www.isoc.org.il/iix/2x_list.html, http://www.isoc.org.il/iix/2x_looking_glass.html, 16, 10300000, 0
506, Europe, Italy, Florence, Tuscany Internet Exchange, Active, Ethernet, Association, 20030000, https://www.tix.it/en/web/guest/home, http://www.e.toscana.it/e-toscana/it/elenco_isp.wp, , 31, 687140, 0
118, Europe, Italy, Milan, Milan Internet Exchange, Active, Ethernet, Association, 20001100, http://www.mix-it.net/, http://www.mix-it.net/index.php?option=com_content&view=article&id=85&Itemid=84&lang=en, , 109, 326030000, 0
1233, Europe, Italy, Milan, Milan Neutral Access Point, Active, Ethernet, University, 20080000, http://www.minap.it/, http://www.minap.it/members/, , 15, 0, 0
1128, Europe, Italy, Padova, VSIX NAP del Nord Est, Active, Ethernet, University, 20090901, http://www.vsix.it, http://www.vsix.it/VSIX/VSIX_completo/Aderenti.html, , 32, 6900000, 0
1890, Europe, Italy, Palermo, DE-CIX Sicily Hub, Active, Ethernet, Commercial, 0, , , , 0, 4100000, 0
120, Europe, Italy, Rome, NaMeX - Nautilus Mediterranean Exchange Point, Active, Ethernet, Association, 19960000, http://www.namex.it, https://www.namex.it/members-traffic-statistics/, , 53, 27772000, 0
121, Europe, Italy, Torino, Torino Piemonte Exchange Point, Active, Ethernet, Association, 20020000, http://www.top-ix.org, http://www.top-ix.org/en/members/, , 85, 57871000, 155020
1132, Europe, Italy, Udine, Friuli Venezia Giulia Internet Exchange, Active, , Commercial, 20090000, http://www.fvg-ix.net/, http://www.fvg-ix.net/index.php?option=com_content&view=article&id=63&Itemid=67&lang=en, , 11, 0, 0
119, Europe, Italy, Rome, CASPUR, Not an exchange, , , 0, , , , 0, 0, 0
1814, Latin America, Jamaica, Kingston, Jamaica Internet Exchange Point, Active, Ethernet, Governmental, 20140831, , , , 0, 0, 1372
141, Asia-Pacific, Japan, Fukuoka, BBIX Fukuoka, Active, Ethernet, Commercial, 20041000, http://www.bbix.net/en/service/ix/, , , 0, 0, 0
139, Asia-Pacific, Japan, Nagoya, BBIX Nagoya, Active, Ethernet, Commercial, 20050500, http://www.bbix.net/en/service/ix/, , , 0, 0, 0
123, Asia-Pacific, Japan, Nagoya, JPIX Nagoya, Active, Ethernet, Commercial, 20010400, http://www.jpix.ad.jp/en/, http://www.jpix.ad.jp/en/user/user.html, , 11, 412870000, 0
1857, Asia-Pacific, Japan, Niigata, Echigo-IX, Active, Ethernet, Association, 20110900, http://www.echigo-ix.jp, http://www.echigo-ix.jp/list.html, , 5, 0, 0
138, Asia-Pacific, Japan, Osaka, BBIX Osaka, Active, Ethernet, Commercial, 20030900, http://www.bbix.net/en/service/ix/, , , 0, 0, 0
125, Asia-Pacific, Japan, Osaka, JPIX Osaka, Active, Ethernet, Commercial, 20020400, http://www.jpix.ad.jp/en/, http://www.jpix.ad.jp/en/user/user.html, , 11, 0, 0
126, Asia-Pacific, Japan, Osaka, JPNAP Osaka, Active, Ethernet, Commercial, 20020002, http://www.mfeed.co.jp/english/jpnap-osaka/index.html, http://www.mfeed.co.jp/english/jpnap-osaka/customer.html, , 37, 108510000, 0
128, Asia-Pacific, Japan, Osaka, NSPIXP-3, Active, Ethernet, University, 19970300, http://nspixp.wide.ad.jp/3/, , , 23, 72000000, 0
137, Asia-Pacific, Japan, Tokyo, BBIX Tokyo, Active, Ethernet, Commercial, 20030700, http://www.bbix.net/en/service/ix/, , , 0, 0, 0
142, Asia-Pacific, Japan, Tokyo, Equinix IBX Tokyo, Active, , Commercial, 20010529, http://www.equinix.nl/insight-center/videos/tour-ibx-by-market/tokyo-ibx/, , , 0, 0, 0
129, Asia-Pacific, Japan, Tokyo, Japan Internet Exchange, Active, Ethernet, Commercial, 19970700, http://www.jpix.ad.jp, http://www.jpix.ad.jp/en/user/user.html, , 135, 412870000, 73585
124, Asia-Pacific, Japan, Tokyo, JPIX Nihonbashi, Active, Ethernet, Commercial, 20040400, http://www.jpix.ad.jp/en/, http://www.jpix.ad.jp/en/user/user.html, , 0, 0, 0
130, Asia-Pacific, Japan, Tokyo, JPNAP Tokyo I - Otemachi, Active, Ethernet, Commercial, 20010000, http://www.jpnap.net/english/jpnap-tokyo-i/index.html, http://www.jpnap.net/english/jpnap-tokyo-i/customer.html, , 101, 505470000, 0
894, Asia-Pacific, Japan, Tokyo, JPNAP Tokyo II - Ikebukuro, Active, Ethernet, Commercial, 20080401, http://www.jpnap.net/english/jpnap-tokyo-ii/index.html, http://www.jpnap.net/english/jpnap-tokyo-ii/customer.html, , 4, 31000000, 0
134, Asia-Pacific, Japan, Tokyo, Network Service Provider IXP (Distributed IX in Edo), Active, Ethernet, Association, 19961000, http://nspixp.wide.ad.jp/2/, , , 85, 23000000, 5488
135, Asia-Pacific, Japan, Tokyo, Network Service Provider IXP-6, Active, Ethernet, Association, 19990800, http://www.wide.ad.jp/nspixp6/, http://member.wide.ad.jp/nspixp6/peering-status.html, , 51, 100000, 0
656, Asia-Pacific, Japan, Akita, Akita Regional IX, Unknown, , Unknown, 0, http://www.jetro.go.jp/en/invest/region/akita/#p2, , , 0, 0, 0
122, Asia-Pacific, Japan, Kyoto, Kyoto Municipal Exchange, Unknown, Ethernet, , 0, , , , 0, 0, 0
1834, Asia-Pacific, Japan, Okinawa, BBIX Okinawa, Defunct, Ethernet, Commercial, 20060900, http://www.bbix.net/en/service/ix/, , , 0, 0, 0
127, Asia-Pacific, Japan, Osaka, NSPIXP-2, Deprecated, Ethernet, Unknown, 19970300, , , , 0, 0, 0
140, Asia-Pacific, Japan, Sendai, BBIX Sendai, Defunct, Ethernet, Commercial, 20040800, http://www.bbix.net/en/service/ix/, , , 0, 0, 0
132, Asia-Pacific, Japan, Tokyo, Media Exchange Co., Not an exchange, , Unknown, 0, http://www.mex.ad.jp/, , , 0, 0, 0
133, Asia-Pacific, Japan, Tokyo, Network Service Provider IXP, Defunct, Ethernet, , 19940400, , , , 0, 0, 0
136, Asia-Pacific, Japan, Tokyo, Pihana Tokyo, Not an exchange, , , 0, , , , 0, 0, 0
1858, Asia-Pacific, Japan, Tokyo, Tokyo Lambda Exchange, Unknown, Ethernet, University, 20040300, http://www.t-lex.net, , , 0, 0, 0
923, Europe, Kazakhstan, Almaty, Kazakhstan Internet Exchange (Kaz-IX), Almaty, Unknown, Ethernet, Unknown, 0, http://www.kaz-ix.kz/web/, http://www.kaz-ix.kz/web/parter.php, , 3, 0, 0
1924, Africa, Kenya, Mombasa, Mombasa Internet Exchange Point, Active, Ethernet, Association, 20160601, , , , 3, 0, 0
143, Africa, Kenya, Nairobi, Kenya Internet Exchange Point, Active, Ethernet, Association, 20010200, http://www.kixp.or.ke, http://www.kixp.or.ke/index.php?option=com_content&task=view&id=41&Itemid=23, , 30, 1330000, 4930
1207, Africa, Kenya, Mombasa, AMS-IX East Africa, Defunct, Ethernet, Association, 20100800, https://eastafrica.ams-ix.net, https://eastafrica.ams-ix.net/connected_parties, , 3, 845679, 0
144, Asia-Pacific, Korea, Seoul, 6NGIX, Active, Ethernet, Governmental, 20010800, http://vsix.net/eng/, http://vsix.net/eng/, , 27, 0, 0
147, Asia-Pacific, Korea, Seoul, Korea Internet Neutral Exchange KINX, Active, Ethernet, Association, 19990600, https://global.kinx.net/, http://ix.kinx.net/eng/service/reference.asp, , 46, 210000000, 40327
145, Asia-Pacific, Korea, Seoul, LGDACOM Internet Exchange, Active, Ethernet, Commercial, 19961000, , , , 52, 70000000, 0
146, Asia-Pacific, Korea, Seoul, Korea Internet Data Center, Unknown, , Unknown, 19991000, http://www.kidc.net/eng/, , , 200, 300000000, 0
148, Asia-Pacific, Korea, Seoul, Korea Internet Exchange KIX, Unknown, Ethernet, Unknown, 19961000, http://www.kix.ne.kr, , , 15, 6000000, 0
149, Asia-Pacific, Korea, Seoul, Korea Telecom Internet Exchange, Not an exchange, Layer-3, , 19961000, http://www.kix.net, , , 45, 65000000, 0
150, Asia-Pacific, Korea, Seoul, Pihana Seoul, Not an exchange, , , 0, , , , 0, 0, 0
1702, Europe, Kosovo, Prishtinë, KOSIX Internet Exchange Point, Active, Ethernet, Governmental, 20110623, http://www.kosix.net, http://www.kosix.net/en-us/members/listofmembers.aspx, , 4, 60000, 0
1283, Asia-Pacific, Laos, Vientiane, Lao National Internet Center, Active, Ethernet, Governmental, 20100901, http://www.lanic.la, , , 7, 1000, 0
1236, Europe, Latvia, Riga, Santa Monica Internet Local Exchange, Active, Ethernet, Commercial, 20051011, http://www.smile-ixp.net/, , http://lg.smile.smn.lv/cgi-bin/lg/lg.cgi, 29, 8900000, 327
151, Europe, Latvia, Riga, Latvian Internet Exchange, Not an exchange, Layer-3, Commercial, 20070600, http://www.lix.lv, http://www.lix.lv/site/members, http://lg.lix.lv/lg.cgi, 18, 0, 0
693, Europe, Lebanon, Beirut, Beirut Internet Exchange, Active, Ethernet, Association, 20071206, http://www.beirutix.net, , , 5, 63400, 74
1925, Africa, Lesotho, Maseru, Lesotho Internet Exchange Point, Active, , Association, 0, , , , 0, 0, 0
1303, Africa, Lesotho, Maseru, Lesotho Internet Exchange, , Ethernet, University, 0, , , , 0, 0, 0
1897, Africa, Liberia, Monrovia, Liberia Internet Exchange Point, Active, Ethernet, Association, 20150804, , , , 6, 2000, 108
1859, Europe, Liechtenstein, Eschen, Rheintal Internet Exchange, Active, Ethernet, Association, 20111027, http://www.rheintal-ix.net, http://www.rheintal-ix.net/rheintal_ix/participants/, , 12, 109070, 0
1576, Europe, Lithuania, Vilnius, Lithuania Internet Exchange, Active, Ethernet, Commercial, 20100000, http://www.litix.lt, , , 5, 2970000, 0
926, Europe, Lithuania, Vilnius, Lithuanian Internet service providers exchange unit, Active, Ethernet, Governmental, 20080000, http://is.lt/, , , 24, 0, 0
1234, Europe, Luxembourg, Luxembourg, Luxembourg Commercial Internet Exchange, Active, Ethernet, Commercial, 20100000, http://www.lu-cix.lu/, http://www.lu-cix.lu/members-list.html, , 71, 32000000, 0
152, Europe, Luxembourg, Luxembourg, Luxembourg Internet Exchange, Defunct, Ethernet, Unknown, 19980000, http://www.lix.lu/, http://www.restena.lu/restena/en/EN-LIXMembersNet.html, , 12, 159550, 0
1881, Africa, Madagascar, Antananarivo, Madagascar Global Internet Exchange, Active, Ethernet, Association, 20160316, http://www.mgix.mg, http://wiki.mgix.mg/display/PUB/Peers, http://lg.mgix.mg, 6, 16000, 454
1029, Africa, Malawi, Blantyre, Malawi IXP, Active, Ethernet, Association, 20081201, http://www.mispa.org.mw/mix.html, http://www.mispa.org.mw/members.html, , 36, 10000, 168
601, Asia-Pacific, Malaysia, Kuala Lumpur, Malaysia Internet Exchange, Active, Ethernet, Governmental, 20061215, http://www.myix.gov.my/, http://www.myix.gov.my/peering-status.html, , 23, 838000, 0
153, Asia-Pacific, Malaysia, Kuala Lumpur, Asia Regional Internet Exchange NAP, Not an exchange, , , 0, http://www.arix-nap.net/, , , 0, 0, 0
154, Asia-Pacific, Malaysia, Kuala Lumpur, Kuala Lumpur Internet Exchange, Not an exchange, Layer-3, , 0, , , , 0, 0, 0
155, Europe, Malta, Msida, Malta Internet Exchange, Active, Ethernet, University, 19990907, http://www.mix.net.mt, http://www.mix.net.mt/participants.html, , 12, 0, 0
1899, Latin America, Martinique, Schoelcher, Martinix, Unknown, , Unknown, 20150101, https://www.renater.fr/martinix?lang=fr, https://www.renater.fr/isp-raccordes-sur-le-martinix, , 0, 292900, 0
1888, Africa, Mauritania, Nouakchott, Mauritania IX, Planned, Ethernet, Unknown, 0, , , , 0, 0, 0
1904, Africa, Mauritania, Nouakchott, RIMIX, Planned, Ethernet, Governmental, 20151202, , , , 0, 0, 0
156, Africa, Mauritius, Ebene, Mauritius Internet Exchange, Active, Ethernet, Association, 20051200, http://www.mixp.org/index.html, http://www.mixp.org/index.html#members, , 10, 30000, 197
1844, North America, Mexico, Mexico DF, Mexico IXP, Active, Ethernet, Association, 20140430, http://ixp.mx, http://www.ixp.mx/informacion_gral/socios.html, , 10, 1000000, 89
1237, Europe, Moldova, Chisinau, Moldova Internet Exchange, Not an exchange, Layer-3, Commercial, 0, http://www.moldtelecom.md/en/operators/exchange/, http://www.moldtelecom.md/common/PDF/PDF_content/Operatori/Internet_Exchange_lista_ro.pdf, , 0, 0, 0
157, Asia-Pacific, Mongolia, Ulan Bator, Mongolia Internet Exchange, Active, Ethernet, Association, 20010500, http://www.infocon.mn/info/node/95, , , 6, 0, 0
1587, Asia-Pacific, Mongolia, Ulaanbaatar, Mangolian Internet Exchange and Mangolian National Data Center, Planned, Ethernet, Unknown, 0, http://www.datacenter.gov.mn/, , , 0, 0, 0
1917, Africa, Morocco, Casablanca, cas-ix, Unknown, , Unknown, 0, , , , 0, 0, 0
158, Africa, Mozambique, Maputo, Mozambique Internet Exchange, Active, Ethernet, University, 20020700, http://www.mozix.org.mz, http://www.mozix.org.mz/membros.htm, , 17, 482418, 0
1784, Africa, Namibia, Windhoek, Windhoek IXP, Active, Ethernet, Association, 20140307, http://www.ixp.org.na, , , 5, 50000, 99
159, Asia-Pacific, Nepal, Kathmandu, Nepal Internet Exchange, Active, Ethernet, Association, 20020800, http://www.npix.net.np/, http://www.npix.net.np/members, , 31, 703560, 406
160, Europe, Netherlands, Amsterdam, Amsterdam Internet Exchange, Active, Ethernet, Association, 19971229, http://www.ams-ix.net, http://www.ams-ix.net/connected/, , 783, 7694800000, 959824
572, Europe, Netherlands, Amsterdam, Neutral Internet Exchange, Active, Ethernet, Association, 20020301, http://www.nl-ix.net, https://www.nl-ix.net/members/full-memberlist/, , 547, 1200000000, 98948
162, Europe, Netherlands, Enschede, Nederlands-Duitse Internet Exchange, Active, Ethernet, Commercial, 20010400, http://www.ndix.net, , , 21, 50000, 0
163, Europe, Netherlands, Groningen, Groningen-IX, Active, Ethernet, Association, 20010000, http://www.gn-ix.net/, http://www.gn-ix.net/content/customerlist, , 51, 0, 0
508, Europe, Netherlands, Leeuwarden, Friese Internet Exchange, Active, , Association, 20060126, http://www.fr-ix.nl/, http://www.fr-ix.nl/index.php?option=com_content&view=article&id=121&Itemid=107, , 38, 1460000, 0
803, Europe, Netherlands, Rotterdam, Rotterdam Internet eXchange, Active, Ethernet, Association, 20070000, http://www.r-ix.nl/, http://www.r-ix.nl/content/customerlist, , 63, 0, 0
161, Europe, Netherlands, Amsterdam, XchangePoint Amsterdam IPP, Unknown, Ethernet, , 0, , , , 0, 0, 0
599, Europe, Netherlands, Den Haag, Den Haag Internet Exchange, Defunct, Ethernet, Unknown, 19970000, , , , 2, 0, 0
1880, Asia-Pacific, New Zealand, Auckland, Auckland Internet Exchange, Active, Ethernet, Association, 0, http://akl-ix.nz, , , 0, 0, 0
164, Asia-Pacific, New Zealand, Auckland, Auckland Peering Exchange, Active, Ethernet, Commercial, 19990810, http://ape.nzix.net/, http://ape.nzix.net/peers.html, http://nzix.net/cgi-bin/lg.cgi?router=rs1.ape.net.nz, 92, 17080000, 21238
1879, Asia-Pacific, New Zealand, Auckland, MegaPort-IX Auckland, Active, Ethernet, Commercial, 20141120, https://www.megaport.com, , https://lg.megaport.com/, 4, 0, 0
165, Asia-Pacific, New Zealand, Christchurch, Christchurch Internet Exchange, Active, Ethernet, Commercial, 20070000, http://chix.nzix.net/, http://chix.nzix.net/peers.html, http://nzix.net/cgi-bin/lg.cgi?router=rs1.chix.nzix.net, 12, 0, 2598
1264, Asia-Pacific, New Zealand, Hamilton, Hamilton Internet Exchange, Active, Ethernet, Municipal, 20100000, http://hix.nzix.net/, http://hix.nzix.net/peers.html, http://nzix.net/cgi-bin/lg.cgi, 2, 0, 0
168, Asia-Pacific, New Zealand, Palmerston North, Palmerston North Internet Exchange, Active, Ethernet, Commercial, 20041130, http://pnix.nzix.net/, http://pnix.nzix.net/peers.html, http://nzix.net/cgi-bin/lg.cgi?router=rs1.pnix.nzix.net, 4, 0, 10
171, Asia-Pacific, New Zealand, Wellington, Wellington Internet Exchange, Active, Ethernet, Commercial, 19961200, http://wix.nzix.net/, http://wix.nzix.net/peers.html, http://nzix.net/cgi-bin/lg.cgi?router=rs1.wix.net.nz, 90, 540000, 6325
166, Asia-Pacific, New Zealand, Dunedin, Dunedin Peering Exchange, Defunct, Ethernet, Unknown, 20050000, http://dpe.nzix.net/, http://dpe.nzix.net/peers.html, , 3, 0, 0
167, Asia-Pacific, New Zealand, Invercargill, Southland Internet Exchange, Planned, Ethernet, , 0, http://six.nzix.net/, , , 0, 0, 0
170, Asia-Pacific, New Zealand, Upper Hutt/Lower Hutt/Porirua, Three Cities Internet Exchange, Defunct, Ethernet, Unknown, 20050600, http://3cix.nzix.net/, http://3cix.nzix.net/peers.html, , 4, 0, 0
169, Asia-Pacific, New Zealand, Waikato, New Zealand Internet Exchange (Defunct), Defunct, , , 0, http://www.waikato.ac.nz/NZIX/, , , 0, 0, 0
172, Latin America, Nicaragua, Managua, Nicaraguan Internet Exchange, Active, Ethernet, Association, 20040400, http://www.ain.org.ni/index.php/nicix, http://www.ain.org.ni/index.php/nicix#Miembros, , 10, 165516, 0
1921, Africa, Niger, Niamey, , Unknown, Ethernet, University, 0, , , , 0, 0, 0
1884, Africa, Nigeria, Abuja, IXPN - Abuja, Active, Ethernet, Association, 20110728, http://www.ixpn.net.ng, http://ixp.net.ng/abuja-member-list/, , 4, 0, 0
616, Africa, Nigeria, Lagos, IXPN - Lagos, Active, Ethernet, Association, 20070500, http://www.ixp.net.ng/, http://ixp.net.ng/member-list/, http://lg.ixp.net.ng/lg/, 30, 1600000, 1809
173, Africa, Nigeria, Ibadan, Ibadan Internet Exchange, Defunct, Ethernet, Association, 20020300, http://www.ib-ix.net, , , 2, 0, 0
1886, Africa, Nigeria, Kano, IXPN - Kano, Planned, Ethernet, Association, 0, http://ixp.net.ng, , , 0, 0, 0
1885, Africa, Nigeria, Port Harcourt, IXPN - Port Harcourt, Defunct, Ethernet, Association, 20120517, http://ixp.net.ng, , , 2, 0, 0
1507, Europe, Norway, Bergen, Bergen Internet Exchange, Active, Ethernet, University, 20040000, http://www.nix.no/, http://www.uio.no/tjenester/it/nett/fastnett/nix/nix-ops.html, , 12, 178403, 0
767, Europe, Norway, Oslo, Free Internet eXchange Oslo, Active, Ethernet, Association, 20080116, http://www.fixo.no, http://www.fixo.no/members, , 55, 0, 0
174, Europe, Norway, Oslo, Norwegian Internet Exchange Oslo 1, Active, Ethernet, University, 19930300, http://www.nix.no/, http://www.uio.no/nix/nix-ops.html, , 61, 55600096, 0
1506, Europe, Norway, Oslo, Norwegian Internet Exchange Oslo 2, Active, Ethernet, University, 20000500, http://www.nix.no/, http://www.uio.no/tjenester/it/nett/fastnett/nix/nix-ops.html, , 61, 8996474, 0
1508, Europe, Norway, Trondheim, Trondheim Internet Exchange, Active, Ethernet, University, 20050000, http://www.nix.no/, http://www.uio.no/tjenester/it/nett/fastnett/nix/nix-ops.html, , 12, 698102, 0
1511, Europe, Norway, Stavanger, Stavanger Internet exchange, Unknown, , University, 20070000, http://www.nix.no/, http://www.uio.no/tjenester/it/nett/fastnett/nix/nix-ops.html, , 0, 0, 0
1512, Europe, Norway, Tromsø, Tromsø Internet exchange, Unknown, Ethernet, University, 20070000, http://www.nix.no/, http://www.uio.no/tjenester/it/nett/fastnett/nix/nix-ops.html, , 0, 0, 0
1285, Asia-Pacific, Pakistan, Karachi, Zero Point Internet Exchange, Active, Ethernet, Association, 20110110, http://zpix.pk, , , 4, 3600, 0
1544, Asia-Pacific, Pakistan, , Pakistan Internet Exchange, Planned, , Unknown, 20000000, , , , 0, 0, 0
1575, Asia-Pacific, Pakistan, , Transworld Internet Exchange, Planned, , Association, 0, http://www.saifgroup.com/transworld.php, , , 0, 0, 0
175, Asia-Pacific, Pakistan, Karachi, Pakistan Network Access Point, Defunct, , Governmental, 0, , , , 0, 0, 0
1783, Europe, Palestine, Ramallah, Palestinian Internet Exchange, Active, Layer-3, Association, 20120604, http://pix.ps, http://pix.ps/index.php?option=com_content&view=article&id=54&Itemid=53, , 9, 27300, 436
176, Latin America, Panama, Panama City, Intered Panamá, Active, Ethernet, Governmental, 19960000, , , , 10, 34700, 0
1112, Latin America, Panama, , NAP Panamericano S.A., Unknown, Ethernet, Unknown, 0, , , , 0, 0, 0
178, Latin America, Panama, , Secretaria Nacional de Ciencia, Tecnologia e Innovacion, Unknown, , , 0, http://www.senacyt.gob.pa/, , , 0, 0, 0
177, Latin America, Panama, Panama City, NAP Panamericano S.A., Defunct, , , 0, http://www.sunglobefiber.com/panamnap.htm, , , 0, 0, 0
1898, Asia-Pacific, Papua New Guinea, Port Moresby, PNG-IXP, Active, , Association, 20150901, http://202.165.202.187/, http://202.165.202.187/index.php/2015/09/05/members/, , 5, 0, 0
179, Latin America, Paraguay, Asuncion, CAPADI NAP-PY, Active, Ethernet, Association, 20000920, http://www.capadi.org.py, http://www.capadi.org.py/articulo.php?id=17, , 15, 40000, 0
181, Latin America, Peru, Lima, NAP Perú, Active, , Association, 20010514, http://www.nap.pe, , , 14, 0, 0
1683, Latin America, Peru, Lima, NAP Inca, Not an exchange, Ethernet, Commercial, 20110000, , , , 5, 0, 0
180, Latin America, Peru, Lima, NAP Lima, Defunct, Ethernet, Commercial, 0, , , , 0, 0, 0
539, Asia-Pacific, Philippines, Manila, Philippine Open Internet Exchange, Active, Ethernet, Association, 20070000, http://www.phopenix.net/, http://www.phopenix.net/members, , 27, 24570000, 5622
182, Asia-Pacific, Philippines, Manila, Common Routing Exchange, Defunct, Ethernet, Association, 19930000, http://www.ph.net/CORE/, http://www.ph.net/CORE/CORE-mem.html, , 6, 0, 0
183, Asia-Pacific, Philippines, Manila, Manila Internet Exchange, Not an exchange, Layer-3, Commercial, 0, http://www.easterntelecom.com.ph/Products/index.asp?ID=39&MCID=3, , , 14, 0, 0
184, Asia-Pacific, Philippines, Manila, Philippines Internet Exchange, Not an exchange, Layer-3, Unknown, 19970100, http://www.phix.net.ph, http://www.phix.net.ph/phix/network.html#isp, , 8, 0, 0
880, Europe, Poland, Katowice, Tysiaclecie Internet Exchange, Active, Ethernet, Association, 20040400, http://www.ix.1000lecie.pl/, http://www.ix.1000lecie.pl/uczestnicy.html, , 7, 0, 0
723, Europe, Poland, Kraków, Krakowski Traffic Exchange Point, Active, , Association, 20091100, http://www.ix.krakow.pl, http://www.ix.krakow.pl/?str=uczestnicy, , 52, 0, 0
1238, Europe, Poland, Lodz, Lodz Internet Exchange, Active, Ethernet, Commercial, 20090000, http://www.lix.net.pl/, http://www.lix.net.pl/uczestnicy/, http://www.lix.net.pl/lg, 17, 10200000, 0
917, Europe, Poland, Poznan, Poznan Internet Exchange, Active, Ethernet, Association, 20060310, http://www.pix.net.pl/, http://www.pix.net.pl/uczestnicy.html, , 82, 17420000, 0
1645, Europe, Poland, Warsaw, Krajowa Izba Komunikacji Ethernetowej, Active, Ethernet, Association, 20090000, http://www.kike.pl/en/, http://tanie-lacze.pl/uczestnicy/, , 11, 0, 0
509, Europe, Poland, Warsaw, Polish Internet Exchange, Active, Ethernet, Commercial, 20060402, http://www.plix.pl/, http://www.plix.pl/pl/member, http://www.plix.pl/en/network/looking_glass, 278, 514030000, 221604
918, Europe, Poland, Warsaw, Thinx Poland, Active, Ethernet, Commercial, 20060000, http://www.thinx.pl/, http://en.thinx.pl/internet_exchange/members, http://lg.atman.pl/, 165, 65440000, 0
1636, Europe, Poland, Warsaw, TPIX - Internet Exchange, Active, Ethernet, Commercial, 20101100, http://www.tpix.pl/, http://www.tpix.pl/uczestnicy.html, http://lg.tpix.pl, 131, 147450000, 0
185, Europe, Poland, Warsaw, Warsaw Internet Exchange, Active, Ethernet, Association, 19960000, http://www.wix.aster.pl/vxb/w/, http://www.wix.aster.pl/vxb/w/index.asp?sid=e1130c4dbcc8bf8b213df928bdc8926c&klienci_x=klienci, , 42, 4860000, 0
725, Europe, Poland, Wroclaw, Wroclaw Internet eXchange, Active, Ethernet, Association, 20010200, http://wrix.org, http://wrix.org/uczestnicy/, , 8, 0, 0
1076, Europe, Poland, , Silesian Internet Exchange, Unknown, Ethernet, Unknown, 0, , , , 0, 0, 0
186, Europe, Portugal, Lisbon, Gigabit Portugese Internet Exchange, Active, Ethernet, University, 19950000, http://www.fccn.pt/pt/servicos/conectividade-e-infraestrutura/gigapix/, http://www.fccn.pt/pt/servicos/conectividade-e-infraestrutura/gigapix/redes-ligadas/, , 22, 32190000, 0
187, Europe, Portugal, Oporto, Gigabit Portugese Internet Exchange, Planned, Ethernet, , 0, http://www.fccn.pt/gigapix, , , 0, 0, 0
583, North America, Puerto Rico, San Juan, Internet Exchange of Puerto Rico, Active, Ethernet, Association, 20060416, http://www.ix.pr/, http://www.ix.pr/members.php, , 2, 0, 0
1920, Europe, Qatar, Doha, Qatar Internet Exchange Point, Active, Ethernet, Association, 20160604, http://ixp.qa, , , 4, 0, 0
1385, Europe, Romania, Bucharest, Balcan-IX, Active, Ethernet, Commercial, 20080000, http://www.balcan-ix.net, http://www.balcan-ix.net/en/clienti_lista.php, http://www.balcan-ix.net/en/clienti_lg.php, 24, 37000000, 0
804, Europe, Romania, Bucharest, InterLAN-IX, Active, Ethernet, Association, 20070000, http://www.interlan.ro/, http://www.interlan.ro/?t=5, http://lg.interlan.ro/summary/rs1/ipv4, 56, 26410000, 0
189, Europe, Romania, Bucharest, Romanian National Internet Exchange, Active, Ethernet, Association, 20010907, http://www.ronix.ro/, http://www.ronix.ro/membri.php, http://www.ronix.ro/lgpublic/, 33, 31580000, 0
188, Europe, Romania, Bucharest, Bucharest Internet Exchange, Defunct, Ethernet, Unknown, 19990000, http://www.buhix.ro/, http://www.buhix.ro/toc.htm, , 17, 0, 0
513, Europe, Romania, Suceava, Suceava Internet Exchange, Defunct, Ethernet, Unknown, 0, http://www.svix.ro/default.html, , , 2, 120000, 0
190, Europe, Russia, Ekaterinburg, MSK-IX Ekaterinburg, Active, Ethernet, Commercial, 20121201, http://www.msk-ix.ru/eng/,  http://www.ix.ru/eng/ekt/members/,  http://www.ix.ru/ekt/network/lookingglass.html, 40, 1899467000, 0
1223, Europe, Russia, Kazan, MSK-IX Kazan, Active, Ethernet, Commercial, 20100500, http://www.msk-ix.ru/eng/,  http://www.ix.ru/eng/kzn/members/,  http://www.ix.ru/eng/kzn/lookingglass.html, 10, 1540000, 0
1862, Europe, Russia, Khabarovsk, DataIX Khabarovsk, Active, Ethernet, Commercial, 20130000, http://www.dataix.ru/, http://www.dataix.ru/eng/members/, http://www.dataix.ru/eng/s/11/looking_glass.html, 237, 310000, 0
1867, Europe, Russia, Krasnodar, Sea-IX Internet exchange, Active, Ethernet, Commercial, 20121008, http://sea-ix.ru, http://sea-ix.ru/participants.shtml, http://sea-ix.ru/lg.shtml, 39, 5370000, 0
516, Europe, Russia, Krasnoyarsk, Krasnoyarsk Internet Exchange, Active, Ethernet, Association, 20060000, http://www.krs-ix.ru, http://www.krs-ix.ru/members/, , 50, 70370000, 0
1270, Europe, Russia, Moscow, DataIX Moscow, Active, Ethernet, Commercial, 20101020, http://www.dataix.ru/, http://www.dataix.ru/eng/members/, http://www.dataix.ru/eng/s/11/looking_glass.html, 39, 990000000, 0
191, Europe, Russia, Moscow, MSK-IX Moscow, Active, Ethernet, Commercial, 19951125, http://www.msk-ix.ru/eng/, http://www.msk-ix.ru/eng/members/,  http://www.msk-ix.ru/eng/lookingglass.html, 397, 1925830000, 0
